1,urgent call number from landlin your complimentari number tenerif holiday or number number cash await collect sae t c box number hp number number yf number ppm number
1,number urgent thi is the number nd attempt to contact you you have won number call number befor number t csbcm number wc number n number xx callcost number ppm mobilesvari max number number
1,free for number st week no number nokia tone number you are mob everi week just txt nokia to number get txting and tell you are mate www getz co uk pobox number w number wq norm number p tone number
1,urgent call number from landlin your complementari number tenerif holiday or number number cash await collect sae t c po box number wa number number px number ppm number sender hol offer
1,winner a a valu network custom you have been select to receivea number prize reward to claim call number claim code kl number valid number hour onli
1,okmail dear dave thi is your final notic to collect your number tenerif holiday or number cash award call number from landlin tc sae box number cw number wx number ppm
1,number rodger burn messag we tri to call you re your repli to our sm for a free nokia mobil free camcord plea call now number for deliveri tomorrow
1,urgent thi is the number nd attempt to contact you you have won number call number befor number t csbcm number wc number n number xx callcost number ppmmobilesvari max number number
1,congrat nokia number video camera phone is your call number call cost number ppm ave call number min vari from mobil number close number post bcm number ldn wc number n number xx
1,urgent plea call number your abta complimentari number spanish holiday or number number cash await collect sae t c box number po number number ez number ppm number
1,congrat number mobil number g videophon r your call number now videochat wid you are mate play java game dload polyph music nolin rentl bx number ip number number we number p
1,dear number xxxxxxx you have been invit to xchat thi is our final attempt to contact you txt chat to number number p msgrcvdhg suit number number land row w number j number hl ldn number yr
1,win the newest harri potter and the order of the phoenix book number repli harri answer number question chanc to be the first among reader
1,sm auction a brand new nokia number is up number auction today auction is free number join take part txt nokia to number now
1,number urgent your mobil no number xxxxxxxxx won a number number bonu caller prize on number number number thi is the number nd attempt to reach you call number a soon a possibl
1,dear you have been invit to xchat thi is our final attempt to contact you txt chat to number
1,number you have won a number number price to claim call number
1,you are chosen to receiv a number award pl call claim number number to collect your award which you are select to receiv a a valu mobil custom
1,number number do you want a new nokia number i colour phone deliveredtomorrow with number free minut to ani mobil number free text free camcord repli or call number
1,urgent your mobil wa award a number number bonu caller prize on number number number our final attempt number contact you call number
1,congrat number mobil number g videophon r your call number now videochat wid your mate play java game dload polyph music nolin rentl
1,wan number win a meet greet with westlif number you or a m number they are current on what tour number unbreak number untam number unkempt text number number or number to number cost number p std text
1,urgent thi is our number nd attempt to contact you your number prize from yesterday is still await collect to claim call now number
1,want explicit sex in number sec ring number now cost number p min
1,sorri i miss your call let u talk when you have the time i am on number
1,congratul you have won you are a winner in our august number prize draw call number now prize code number
1,fantasi footbal is back on your tv go to sky gamestar on sky activ and play number k dream team score start on saturday so regist now sky opt out to number
1,number kick off a new season with number wk free goal news to you are mobil txt you are club name to number eg villa to number
1,thi is the number nd attempt to contract you you have won thi week top prize of either number cash or number prize just call number
1,you have won number number cash or a number number prize to claim call number
1,talk sexi make new friend or fall in love in the world most discreet text date servic just text vip to number and see who you could meet
1,today vodafon number end with number are select to a receiv a number award if your number match call number to receiv your number award
1,gent we are tri to contact you last weekend draw show that you won a number prize guarante call number claim code k number valid number hr onli number ppm
1,camera you are award a sipix digit camera call number fromm landlin deliveri within number day
1,you ve won your number costa del sol holiday or number await collect call number now toclaim sae tc s pobox number stockport sk number xh cost number number pm max number min
1,well done your number costa del sol holiday or number await collect call number now toclaim sae tc pobox number stockport sk number xh cost number number pm max number min
1,congratul you are award number of cd voucher or number gift guarante free entri number number wkli draw txt music to number
1,loan for ani purpos number number number homeown tenant welcom have you been previous refus we can still help call free number number or text back help
1,thi is the number nd time we have tri number contact you you have won the number pound prize number claim is easi call number now number onli number p per minut bt nation rate
1,congrat number year special cinema pas for number is your call number now c suprman v matrix number starwar number etc all number free bx number ip number number we number pm do not miss out
1,messag import inform for o number user today is your lucki day number find out whi log onto link there is a fantast surpris await you
1,had your mobil number month or more you r entitl to updat to the latest colour mobil with camera for free call the mobil updat co free on number
1,bloomberg messag center number whi wait appli for your futur link bloomberg com
1,sppok up you are mob with a halloween collect of nokia logo pic messag plu a free eeri tone txt card spook to number
1,number p number alfi moon is child in need song on you are mob tell you are m number s txt tone chariti to number for nokia or poli chariti for poli zed number profit number chariti
1,urgent your mobil no wa award a number number bonu caller prize on number number number thi is our number nd attempt to contact you call number number number box number qu
1,phoni number award today voda number end xxxx are select to receiv a number award if you have a match plea call number quot claim code number standard rate app
1,we tri to contact you re your respons to our offer of a new nokia fone and camcord hit repli or call number for deliveri
1,hello from orang for number month is free access to game news and sport plu number free text and number photo messag repli ye term appli www orang co uk ow
1,you are hmv quiz cash balanc is current number to maxim you are cash in now send hmv number to number onli number p messag
1,you have won a a valu vodafon custom our comput ha pick you to win a number prize to collect is easi just call number
1,congratul you are award either a yr suppli of cd from virgin record or a mysteri gift guarante call number t c www smsco net number number pm approx number min
1,a number xma reward is wait for you our comput ha randomli pick you from our loyal mobil custom to receiv a number reward just call number
1,decemb onli had your mobil number mth you are entitl to updat to the latest colour camera mobil for free call the mobil updat co free on number
1,number xma iscom you are award either number cd gift voucher free entri number are number weekli draw txt music to number tnc
1,six chanc to win cash from number to number number pound txt csh number and send to number cost number p day number day number tsandc appli repli hl number info
1,today voda number end number are select to receiv a money number award if you have a match plea call number quot claim code number standard rate app
1,congratul thank to a good friend you have won the number number xma prize number claim is easi just call number now onli number p per minut bt nation rate
1,you have won a guarante number cash or a number prize to claim yr prize call our custom servic repres on number between number am number pm cost number p
1,you are a winner you have been special select to receiv number cash or a number award speak to a live oper to claim call number am number pm cost number p
1,interflora it is not too late to order interflora flower for christma call number number to place your order befor midnight tomorrow
1,number free for number st week no number nokia tone number you are mob everi week just txt nokia to number get txting and tell you are mate www getz co uk pobox number w number number wq norm number p tone number
1,congratul you are award either number of cd gift voucher free entri number our number weekli draw txt music to number tnc www ldew com number win number ppmx number age number
1,for the most sparkl shop break from number per person call number number or visit www shortbreak org uk
1,are you uniqu enough find out from number th august www areyouuniqu co uk
1,winner a a valu network custom you hvae been select to receiv a number reward to collect call number valid number hour onli acl number pm
1,congratul you can claim number vip row a ticket number c blu in concert in novemb or blu gift guarante call number to claim t c www smsco net cost number number max
1,thi is the number nd time we have tri to contact you you have won the number prize to claim just call number befor number t c stop sm number number ppm
1,urgent you are number guarante award is still unclaim call number now closingd number number number claimcod m number m number number number pmmorefrommobil number bremov mobypobox number l number yf
1,if you do not your prize will go to anoth custom t c at www t c biz number number p min polo ltd suit number london w number j number hl plea call back if busi
1,no number polyphon tone number you are mob everi week just txt pt number to number number st tone free so get txtin now and tell you are friend number p tone number repli hl number info
1,i do not know you and you do not know me send chat to number now and let u find each other onli number p messag rcvd hg suit number number land row w number j number hl ldn number year or over
1,send a logo number you are lover number name join by a heart txt love name number name number mobno eg love adam eve number to number yahoo pobox number w number wq txtno number no ad number p
1,hmv bonu special number pound of genuin hmv voucher to be won just answer number easi question play now send hmv to number more info www number percent real com
1,plea call our custom servic repres on number number number between number am number pm a you have won a guarante number cash or number prize
1,you are be contact by our date servic by someon you know to find out who it is call from a land line number pobox number w number tg number p
1,number number number uk break accommodationvouch term condit appli number claim you mustprovid your claim number which is number
1,you have an import custom servic announc from premier call freephon number number number now
1,you are award a sipix digit camera call number from landlin deliveri within number day t c box number m number bp number yr warranti number ppm number p p number number
1,plea call our custom servic repres on freephon number number number between number am number pm a you have won a guarante number cash or number prize
1,you are a winner you have been special select number receiv number cash or a number holiday flight inc speak to a live oper number claim number
0,hey sorri i didntgiv ya a a bellearli hunni just been in bedbut mite go number thepub l number tr if uwana mt up load a love jenxxx
0,are you comingdown later
0,hey hey wereth monkeespeopl say we monkeyaround how do you gorgeou howu doin foundurself a jobyet sausag love jen xxx
0,cha quiteamuz that iscool babe probpop in cu satthen hunni number brekki love jen xxx psxtra lrg portion number me plea
0,hey babe far number spun out number spoke at da mo dead number da wrld been sleep on da sofa all day had a cool nytho tx number fonin hon call number mwen i am bk frmcloud number j x
0,cheer you tex mecaus you werebor yeah okden hunni r uin wk sat isound is likeyour havin gr number fun j keep updat countinlot of lovem xxxxx
0,ey calm downon theacus itxt you co iwana know wotu r doin at thew end haventcn you in age ring me if you are up number neth sat love j xxx
0,yeh i am def up number someth sat just got pay number day i havbeen given a number pay rise number my work havebeen made preschoolco ordin number i am feelingood love
0,hi it kate it wa love to see you tonight and ill phone you tomorrow i got to sing and a guy gave me hi card xxx
0,think of you x
0,me too have a love night xxx
0,hey hun onbu goin number meet him he want number go out number a meal but i donyt feel like it cuz have number get last bu home but he sweet latelyxxx
0,hi mate it rv did you hav a nice hol just a messag number say hello coz have not sent you number in age start drive so stay off road rvx
0,i am fine babe are not been up number much though saw scari movi yest it quit funni want number mrw afternoon at town or mall or sumthin xx
0,i notic you like look in the shit mirror you are turn into a right freak
0,i am late tellmiss i am on my way
0,been up to ne thing interest did you have a good birthday when are you wrking nxt i start uni today
0,i am gonnamissu so much i would say il send you a postcard butther abouta much chanc of merememberin asther is ofsi not breakin hi contract love yaxx
0,thanx number the time we have spent number geva it bin mint you are my babi and all i want is you xxxx
0,you stayin out of troubl stranger saw dave the other day he is sort now still with me bloke when you gona get a girl mr you are mum still think we will get number getha
0,thanx number puttin da fone down on me
0,i know dat feelin had it with pete wuld get with them nuther place nuther time mayb
0,you number
0,thanx you darlin i am cool thanx a few birthday drink number nite number morrow off take care c you soon xxx
0,hiya comin number bristol number st week in april le got off rudi on new yr eve but i wa snore they were drunk you bak at colleg yet my work send ink number bath
0,sez how is you de arab boy hope you r all good give my love number evri number love ya eshxxxxxxxxxxx
0,thing r good thanx got exam in march i have done no revis is fran still with boyf i have got to interviw number exet bit worri x
0,i love you number babe r you sure everyth is alrit is he be an idiot txt bak girli
0,i love you soo much you do not understand how special you r number me ring you number morrow love you xxx
0,not much no fight it wa a good nite
0,jade it paul y did not you txt me do you rememb me from barm i want number talk number you txt me
0,look at ami ure a beauti intellig woman and i like you a lot i know you do not like me like that so do not worri
0,get ticket number walsal tue number th march my mate is get me them on sat ill pay my treat want number go txt bak terri
0,alrit jod how is the revis goin keri bin doin a smidgin n e way you want to cum over after colleg xx
0,wot about on wed nite i am number then but onli til number
0,pete is thi your phone still it jenni from colleg and leann what are you up to now
0,sorri about that thi is my mate phone and i did not write it love kate
0,have you finish work yet
0,hmm yeah if your not too groov out and i am look forward to my pound special
0,thank god they are in bed
0,hey do you fanci meetin me at number at cha hav a lil beverag on me if not txt or ring me and we can meet up l number r quit tire got in at number v pist love pete x x x
0,i am reali soz imat my mum number nite what about number moro
0,hi darlin i am on helen fone i am go to b up the princ number nite plea come up tb love kate
0,er enjoyin indian at the mo yep sall good hehe how is bout you shexi pete xx
0,no it wa cancel yeah babi well that sound import so i understand my darlin give me a ring later on thi fone love kate x
0,hi darlin it kate are you up for doin somethin tonight i am go to a pub call the swan or someth with my parent for one drink so phone me if you can
0,i am in inperialmus listen number the weirdest track ever by leafcutt john sound like insect be molest someon plumb remix by evil men on acid
0,hi darlin how wa work did you get into troubl ijust talk to your mum all morn i had a realli good time last night i am goin out soon but call me if you can
0,hi darlin i am missin you hope you are have a good time when are you back and what time if you can give me a call at home jess xx
0,hi babe you r most like to be in bed but i am so sorri about tonight i realli want to see you tomorrow so call me at number love me xxx
0,hi i am have the most relax time ever we have to get up at number am everi day wa the parti good the other night i get home tomorrow at number ish
0,oh fuck juswok up in a bed on a boatin the dock slept wid number year old spinout giv you da gossip l number r xxx
0,boo babe you enjoyin yourjob you seem number b gettin on well hunni hope ure ok take care i willspeak number u soonlot of lovem xxxx
0,hello you call wen you finish wrk i fanci meetin up wiv you all tonit a i need a break from dabook did number hr last nite number today of wrk
0,alrit hunni wot you up number number nite did not end up goin down town ju da pub instead ju chillin at da mo in me bedroom love jen xxx
0,you will switch your fone on dammit
0,hi darlin i cantdo anythingtomorrow a mypar aretak me outfor a meal when are you free katexxx
0,not enufcredeit tocal shall ileav uni at number get a bu to yor hous
0,pete can you plea ring meiv hardli gotani credit
0,can i plea come up now imin town dontmatt if urgoin outl number r just reallyne number docd plea dontpleas dontignor mycal you no thecd isv import tome number number moro
0,ill be at your in about number min but look out for me
0,hi darlin did youphon me i am athom if youwanna chat
0,wot you want to do then missi
0,sari just need tim in the bollox it hurt him a lot so he tol me
0,how are you i have miss you i have not been up number much a bit bore with the holiday want number go bak number colleg sad is not it xx
0,how you doin babi girl hope you are okay everi time i call ure phone is off i miss you get in touch
0,ill b down soon
0,hello hello hi lou sorri it took so long number repli i left mobil at friend in lancast just got it bak neway i am sorri i could not make you are b woulday number hun
0,oh yeah and hav a great time in newquay send me a postcard number look after all the girl while i am gone you know the number im talkin bout xx
0,cheer lou yeah wa a goodnit shame you neva came c ya gailxx
0,wot you up number thout you were go to call me txt bak love k
0,number celebr my b woulday y el
0,fine if that is the way you feel that is the way it gota b
0,my new year eve wa ok i went to a parti with my boyfriend who is thi si then hey
0,i have no money number steve mate
0,i am go to miss you so much
0,jane babe not goin number wrk feel ill after lst nite fone in alreadi cover number me chuck
0,hiya do you like the hlday pic look horribl in them so took mo out how is the camp amrca thing speak soon serena
0,hellogorg how is you my fone wa on charg lst nitw wen you texd me hopeu ad a nice wkend a i am sure you did lookin number ward number c in you number mrw love jaz
0,i realli need number kiss you i miss you my babi from you are babi number eva
0,alrit sam it nic just checkin that thi is you are number so is it t b
0,piss is talk is someon that realis you that point thi at is it now read it backward
0,you goin out number nite
0,okay name you are price a long a it legal wen can i pick them up y you ave x am xx
0,where wuld i be without my babi the thought alon mite break me and i do not want to go crazi but everyboy need hi ladi xxxxxxxx
0,hey no i ad a crap nite wa borin without ya number boggi with me you bore biatch thanx but you wait til nxt time il ave ya
0,hello drivbi number quit edrunk sorri iff pthi make no senrd dnot no how dancc number drum n basq ihav fun number nhite x ro xxxxxxx
0,hi it kate how is your even i hope i can see you tomorrow for a bit but i have to bloodi babyjontet txt back if you can xxx
0,who are you see
0,ok i am not sure what time i finish tomorrow but i want to spend the even with you co that would be vewi vewi lubli love me xxx
0,oh that is late well have a good night and i will give you a call tomorrow iam now go to go to sleep night night
0,cheer for the messag zogtoriu i have been stare at my phone for an age decid whether to text or not
0,i can not wait for cornwal hope tonight is not too bad a well but it is rock night shite anyway i am go for a kip now have a good night speak to you soon
0,hi babe it me thank for come even though it did not go that well i just want my bed hope to see you soon love and kiss xxx
0,just gettin a bit arti with my collag at the mo well tryin number ne way got a roast in a min love i shall enjoy that
0,my no in luton number ring me if you are around h
0,hey there babe how you doin wot you up number number nite love anni x
0,si como no listen number the plaid album quit gd the new air number which is hilari also bought braindanc a comp ofstuff on aphex is abel you hav number hear it c you sn xxxx
0,hi darlin i have just got back and i had a realli nice night and thank so much for the lift see you tomorrow xxx
0,i hope you arnt piss off but id would realli like to see you tomorrow love me xxxxxxxxxxxxxx
0,so is th gower mate which is where i am how r you man all is good in wale ill b back morrow c you thi wk who wa the messag number random
0,hope you are not have too much fun without me see you tomorrow love jess x
0,ah poor babi hope urfeel bettersn love probthat overdos of work hey go care spoke number you sn lot of lovejen xxx
0,hey j r you feel ani better hopeso hunni i amnow feelin ill ithink i may have tonsolitusaswel damn iam layin in bedreal bore lotsof love me xxxx
0,wot you up number j
0,hi babe uawak feellikw shit justfound out via alett thatmum gotmarri number thnov behind ourback fuckinnic selfish deviousbitch anyway i l call you
0,shit babe thasa bit mess up yeh she shudvetold you did urgran know neway illspeak number u number moro wen i am not asleep
0,hey kate hope you are ok will give you a buz wedlunch go outsomewher number adrink in town cud go number watershd number a bit peopl fromwrk will bthere love petexxx
0,petey boy wherear you me and all your friendsar in thekingshead come down if you canlov nic
0,aww you must be nearli dead well jez iscom over todo some workand that whilltak forev
0,alright babe justthought i would sayhey how you doin nearli the endof me wk offdam nevamind we will have number hook up sn if uwant m number lovejen x
0,right it wa not you who phone it wa someon with a number like your
0,y where you at dogbreath it just sound like jan c that is al
0,r you sam p in eachoth if we meet we can go number my hous
0,babe i think i got you are brolli i left it in english wil bring it in number mrw number you love franxx
0,what time you wrkin
0,hey girl how r you hope you r well me an del r bak again long time no c give me a call sum time from lucyxx
0,i have a date on sunday with will
0,hi the way i wa with you number day is the normal way thi is the real me you are uniqu i hope i know you number the rest of mylif hope you find wot wa lost
0,hi hun i am not comin number nite tell everi number i am sorri number me hope you ava goodtim oli rang melnit ifink it mite b sort but il explain everythin on mon l number r x
0,thanx number number day you r a goodmat i think you are rite sari asusu number you cheer me up love you franyxxxxx
0,hey darlin i can pick you up at colleg if you tell me wen where number mt love pete xx
0,happi new year my no number man
0,alrit
0,wot you up number you weirdo
0,you have not lost me ill alway b here number u i did not intend number hurt you but i never knew how you felt about me when iwa marin that is what itri number tell urmom i careabout you
0,wot is you up number then bitch
0,pleassssssseeeee tel me v avent done sportsx
0,no got new job at bar in airport on satsgettin number number per hour but mean no lie in keep in touch
0,i am just wonder what your do right now
0,i love you number my littl poci bell i am sorri but i love you
0,hello peach my cake tast lush
0,thanx number today cer it wa nice number catch up but we ave number find more time more often oh well take care c you soon c
0,pick you are fone up now you dumb
0,there the size of eleph tablet you shove um up you are as
0,i walk an hour number c you doe not that show i care y will not you believ i am seriou
0,tri neva mate
0,i am cool ta love but v tire number becaus i have been doin load of plan all wk we have got our social servic inspect at the nurseri take care spoke sn x
0,sound better than my even i am just do my costum i am not sure what time i finish tomorrow but i will txt you at the end
0,oh ok i did not know what you meant yep i am babi jontin
0,awww dat is sweet we can think of someth to do he he have a nice time tonight ill probabl txt you later co i am lone xxx
0,cud you tell peopl i am gona b a bit l number co number buse hav gon past co they were full i am still waitin number number pete x
0,sorri i am stil fuck after last nite went tobe at number got up number work at number
