1,urgent plea call number from your landlin your complimentari number lux costa del sol holiday or number cash await collect ppm number sae t c jame number eh number rr
0,mm feel sleepi today itself i shall get that dear
0,how dare you stupid i will not tell anyth to you hear after i will not talk to you
0,can you do a mag meet thi avo at some point
0,i meant middl left or right
0,realli i crash out cuddl on my sofa
0,hi chachi tri call you now unabl to reach you pl give me a miss cal onc you c tiz messag kanagu
0,i sent you the price and do you mean the lt gt g
0,no am work on the ring you thing but have whole hous of scream brat so am pull my hair out love you
0,but my famili not respond for anyth now am in room not went to home for diwali but no one call me and whi not come it make me feel like die
0,tick tick tick babe
0,k da how mani page you want
0,ya had just now onion roast
0,send hi number and give repli tomorrow morn for whi you said that to him like that ok
0,you said not now no problem when you can let me know
0,derp which is wors a dude who alway want to parti or a dude who file a complaint about the three drug abus he live with
0,ok chine food on it way when i get fat you are pay for my lipo
0,have a good trip watch out for rememb when you get back we must decid about easter
0,yo we are watch a movi on netflix
0,what time i am out until prob number or so
0,arr birthday today i wish him to get more oscar
0,open rebtel with firefox when it load just put plu sign in the user name place and it will show you two number the lower number is my number onc you pick that number the pin will display okay
0,and pick them up from variou point
1,marri local woman look for discreet action now number real match instantli to your phone text match to number messag cost number p number stop txt stop bcmsfwc number n number xx
0,wow v v impress have fun shop
0,i am on the way to you are home
1,burger king want to play footi at a top stadium get number burger king befor number st sept and go larg or super with coca cola and walk out a winner
0,no problem talk to you later
0,still in custom place
1,how come it take so littl time for a child who is afraid of the dark to becom a teenag who want to stay out all night
0,dude you knw also telugu tht gud k gud nyt
0,send me your id and password
0,kind of took it to garag centr part of exhaust need replac part order n take it to be fix tomo morn
0,well i might not come then
0,long after i quit i get on onli like number minut a day a it is
0,then it most like call mittelschmertz googl it if you do not have paracetamol do not worri it will go
0,well at thi right i am go to have to get up and check today is steam sale pee so text me when you want me to come get you
0,just arriv see you in a coupl day lt number
0,k wat s tht incid
0,yeah get the unlimit
0,forgot it take me number year to shower sorri where you at your phone dead yet
0,when you are big god will bring success
1,you have bin award number to play number instant cash call number to claim everi number th player win min number number optout number
0,we r stayin here an extra week back next wed how did we do in the rugbi thi weekend hi to and and c you soon
0,well there is still a bit left if you guy want to tonight
0,not from thi campu are you in the librari
0,the affidavit say lt gt e twigg st divis g courtroom lt gt lt time gt am i will doubl check and text you again tomorrow
0,how will i creep on you now
0,if i get there befor you after your ten billion call and text so help me god
0,i have told him that i have return it that should i re order it
0,hous maid is the murder coz the man wa murder on lt gt th januari a public holiday all govt instituit are close includ post offic
0,and smile for me right now a you go and the world will wonder what you are smile about and think your crazi and keep away from you grin
1,freemsg fav xma tone repli real
0,lil fever now fine
0,i think it is all still in my car
0,ye princess i want to catch you with my big strong hand
0,oh yeah i forgot you can onli take number out shop at onc
0,mm so you ask me not to call radio
0,thinkin about someon is all good no drug for that
0,enjoy the shower of posse pour on you by you are love one bcoz in thi world of lie it is a golden gift to be love truli
0,alright if you are sure let me know when you are leav
0,some are last a much a number hour you might get lucki
0,geniu what is up how your brother pl send hi number to my skype
1,gr number poli tone number all mob direct number u rpli with poli titl to number eg poli breath number titl crazyin sleepingwith finest ymca getz co uk pobox number o number w number wq number p
0,do not forget who own you and who is privat properti you are and be my good boy alway passion kiss
0,oh god taken the teeth is it pain
1,romcapspam everyon around should be respond well to your presenc sinc you are so warm and outgo you are bring in a real breath of sunshin
0,oh right ok i will make sure that i do load of work dure the day got a realli nasti cough today and is dri n shot so that should realli help it
0,it normal hot mail com you see
0,ya they are well and fine bbd pooja full pimpl even she becom quit black and you are rite here it too cold wear sweatter
0,nice nice how is it work
0,number is reach home call me
0,were tri to find a chine food place around here
0,easi mate guess the quick drink wa bit ambiti
0,babe i miiiiiiissssssssss you i need you i crave you geeee i am so sad without you babe i love you
0,tunji how is the queen how are you do thi is just wish you a great day abiola
0,today iz yellow rose day if you love my frndship give me number misscal amp send thi to you are frndz amp see how mani miss call you get if you get number miss you marri you are lover
0,will be out of class in a few hour sorri
0,she is fine good to hear from you how are you my dear happi new year oh
0,are you go to wipro interview today
0,how tall are you princess
0,i doubt you could handl number time per night in ani case
0,your go to be the death if me i am go to leav a note that say it all rob fault aveng me
0,in life when you face choic just toss a coin not becoz it settl the question but while the coin in the air you will know what your heart is hope for gudni number
0,i want to be there so i can kiss you and feel you next to me
0,i am not at all happi with what you say or do
1,adult number content your video will be with you shortli
0,ok that would b love if you r sure think about wot you want to do drinkin dancin eatin cinema in out about up to you wot about
0,what i am say is if you have not explicitli told nora i know someon i am probabl just not go to bother
0,smith wast da i want to gayl
0,mum i have sent you mani mani messag sinc i got here i just want to know that you are actual get them do enjoy the rest of your day
0,aight tomorrow around lt gt it is
0,i actual did for the first time in a while i went to bed not too long after i spoke with you woke up at number how wa your night
0,see you there
0,i do not understand your messag
0,crucifi is c not s you should have told me earlier
0,i do not know you keep say that you are not but sinc he move we keep but head over freedom v respons and i am tire i have so much other shit to deal with that i am bare keep myself togeth onc thi get ad to it
0,fuck cedar key and fuck her come over anyway though
0,twenti past five he said will thi train have been to durham alreadi or not coz i am in a reserv seat
1,hey boy want hot xxx pic sent direct number you are phone txt porn to number number hr free and then just number p per day to stop text stopbcm sf wc number n number xx
0,printer is cool i mean groovi wine is groovi
0,hi harish is rent ha been transfr to you are acnt
0,cbe is realli good nowaday lot of shop and showroom citi is shape good
0,k i will take care of it
0,i take it we did not have the phone callon friday can we assum we will not have it thi year now
0,my batteri is low babe
0,yeah there is quit a bit left i will swing by tomorrow when i get up
0,babe you said number hour and it is been almost number is your internet down
0,k i will be sure to get up befor noon and see what is what
0,k k yesterday i wa in cbe
0,went to ganesh dress shop
0,aight i should be there by number at the latest probabl closer to number are jay and tyler down or should we just do two trip
0,come aftr lt decim gt now i m clean the hous
0,bill a in are there ani letter for me i am expect one from orang that is not a bill but may still say orang on it
0,tell me pa how is pain de
0,ha you do not know either i did a a clever but simpl thing with pear the other day perfect for christma
0,whi must we sit around and wait for summer day to celebr such a magic sight when the world dress in white oooooh let there be snow
0,how do you guy go to see movi on your side
0,you did not have to tell me that now i am think plu he is go to stop all your run
0,kindli send some one to our flat befor lt decim gt today
1,sorri you can not unsubscrib yet the mob offer packag ha a min term of number week pl resubmit request after expiri repli themob help number more info
0,what time should i tell my friend to be around
0,ye that will be fine love you be safe
0,thank chikku gud nyt
0,yo ani way we could pick someth up tonight
0,i have not sent it he can send me
0,fine am simpli sit
0,tht god is gift for bird a human hav some natur gift frm god
0,are you come to day for class
0,i am done just studyn in librari
0,hi test on lt gt rd
0,onli number student solv thi cat question in xam number number number lt gt number number number lt gt number number number lt gt then number number number tell me the answer if you r brilliant number thing i got d answr
0,yo do you know anyon lt gt or otherwis abl to buy liquor our guy flake and right now if we do not get a hold of somebodi it just number loko all night
0,yeah we got one line up for u
0,and stop wonder wow is she ever go to stop tm ing me becaus i will tm you whenev i want becaus you are mine laugh
0,lol yep did that yesterday alreadi got my fireplac now it just anoth icon sit there for me
0,are you ok what happen to behav like thi
0,hello no news on job they are make me wait a fifth week yeah i am up for some woozl and weasel in exet still but be home about number
1,we current have a messag await your collect to collect your messag just call number
0,hey babe sorri i did not get sooner gari can come and fix it becaus he think he know what it is but he doe not go a far a ptbo and he say it will cost lt gt buck i do not know if it might be cheaper to find someon there we do not have ani second hand machin at all right now let me know what you want to do babe
0,leav it you will alway be ignor
0,at bruce b down amp fletcher now
0,where are you you said you would be here when i woke
0,hey now am free you can call me
0,tell me who is thi pl
0,think i might have to give it a miss am teach til twelv then have lectur at two damn thi work thing
0,id have to check but there is onli like number bowl worth left
0,ye there were mani sweet
0,i would but i am still cozi and exhaust from last night nobodi went to school or work everyth is close
0,buzzzz grin did i buzz your as buzz your chest buzz your cock where do you keep your phone is the vibrat on did you feel it shake
0,sir send to group mail check it
0,you do not know you jabo me abi
1,do you ever notic that when you are drive anyon go slower than you is an idiot and everyon drive faster than you is a maniac
0,not yet had ya sapna aunti maneg y woulday hogidh chinnu full weak and swalpa black agidhan
0,are you be good babi
0,mostli sport type lyk footbl crckt
0,ma head dey swell oh thank for make my day
0,you should make a fb list
0,happi new year princess
0,i will text carlo and let you know hang on
0,do not worri is easi onc have ingredi
0,ok omw now you at castor
1,xma offer latest motorola sonyericsson nokia free bluetooth or dvd doubl min number txt on orang call mobileupd number on number or call number optout number qf number
0,tonight yeah i would be down for that
0,what should i eat fo lunch senor
0,he said that he had a right giggl when he saw you again you would possibl be the first person number die from nvq but think how much you could for
1,repli to win number weekli what profession sport doe tiger wood play send stop to number to end servic
0,i am there and i can see you but you can not see me mayb you should reboot ym i seen the buzz
0,do you still have the grinder
0,k i did t see you k where are you now
0,so i am do a list of buyer
0,no idea i guess we will work that out an hour after we are suppos to leav sinc a usual nobodi ha ani interest in figur shit out befor the last second
0,mm not entir sure i understood that text but hey ho which weekend
0,they releas vday shirt and when you put it on it make your bottom half nake instead of those white underwear
0,don know he is watch film in comput
0,oh then your phone phone me but it disconnect
0,id onluy matter when get on from offcampu
0,excel i will see what riley is plan are
0,ew are you one of them
0,also hi wesley how have you been
0,ah you see you have to be in the lingo i will let you know wot on earth it is when ha finish make it
0,imagin life without me see how fast you are search me wouldo not worri l m alway there to disturb you goodnoon
0,hm good morn headach anyon
0,yeah no prob last night is obvious catch up with you speak soon
1,free unlimit hardcor porn direct number your mobil txt porn to number get free access for number hr then chrgd number p per day txt stop number exit thi messag is free
0,lt gt min but i had to stop somewher first
0,lt gt is fast approach so wish you a veri happi new year happi sankranti happi republ day happi valentin day happi shivratri happi ugadi happi fool day happi may day happi independ day happi friendship mother father teacher child day amp happi birthday number you happi ganesh festiv happi dasara happi diwali happi christma lt gt good morn afternoon even night rememberi am the first to wish you all these your is raj
0,one of the joy in lifei wake up each daywith thought that somewheresomeon care enough tosend a warm morn greet
0,i did not get the second half of that messag
0,i thank you so much for all you do with selfless i love you plenti
0,am in film ill call you later
0,how dare you chang my ring
0,you are a veri veri veri veri bad girl or ladi
0,i love ya too but tri and budget your money better babe gari would freak on me if he knew
0,what part of do not initi do not you understand
0,you still at the game
0,you have got tallent but you are wast
0,what is your record for one night
0,also sir i sent you an email about how to log into the usc payment portal i ll send you anoth messag that should explain how thing are back home have a great weekend
0,go to let me know co come bak from holiday that day is come do not number get number text me number
0,aight let me know what is up
0,get readi for lt gt inch of pleasur
0,ok i feel like john lennon
0,you are not bother me but you have to trust my answer pl
0,one day a crab wa run on the sea shore the wave came n clear the footprint of the crab crab ask be my frnd y r you clear my beauti footprint wave repli a fox wa follow you are footprint to catch you that is y i clear it off frndsship never let u you dwn gud nyt
0,aight what time you want me to come up
0,slaaaaav where are you must i summon you to me all the time now do not you wish to come to me on your own anymor
0,your bill at number is number number so that is not bad
0,let me know how it chang in the next number hr it can even be appendix but you are out of that age rang howev it not imposs so just chill and let me know in number hr
0,hello yeah i have just got out of the bath and need to do my hair so i will come up when i am done yeah
0,so how is the weather over there
0,ok not much to do here though h m friday cannot wait do not know wot the hell i am go to do for anoth number week becom a slob oh wait alreadi done that
0,lol they do not know about my awesom phone i could click delet right now if i want
0,awesom question with a cute answer someon ask a boy how is you are life he smile amp answer she is fine gudnit
0,plea leav thi topic sorri for tell that
0,pl send me the correct name da
0,what happen to our yo date
0,webpag s not avail
0,just woke up yeesh it late but i did not fall asleep til lt gt am
1,you are now unsubscrib all servic get ton of sexi babe or hunk straight to your phone go to link no subscript
0,dear all a we know lt gt th is the lt gt th birthday of our love gopalettan we are plan to give a small gift on that day those who like to particip in that you are welcom plea contact our admin team for more detail
0,k k from tomorrow onward start ah
0,what you talk bout earli morn it is almost noon where your at
0,fine do you rememb me
1,hi babe it jordan how r you i am home from abroad and lone text me back if you want to chat xxsp visionsm com text stop to stopcost number p number
0,ok how mani should i buy
0,sound good keep me post
1,get a brand new mobil phone by be an agent of the mob plu load more goodi for more info just text mat to number
0,ok so april cannot wait
0,boy you best get yo as out here quick
0,i am now but have to wait till number for the bu to pick me
0,apart from the one i told you about yesterday
0,somebodi should go to andro and steal ice
0,don know i did t messag him recent
0,take u out shop and mark will distract isaiah d
0,mum hope you are have a great day hope thi text meet you well and full of life have a great day abiola
0,there is no sen in my foot and peni
0,okay but i thought you were the expert
0,deep sigh i miss you i am realli surpris you have not gone to the net cafe yet to get to me do not you miss me
0,s s i thinl role is like sachin just stand other have to hit
0,have a great trip to india and bring the light to everyon not just with the project but with everyon that is lucki to see you smile bye abiola
0,and veri importantli all we discus is between you and i onli
0,k k how about your train process
0,i wish that i wa with you hold you tightli make you see how import you are how much you mean to me how much i need you in my life
0,so i ask how is anthoni dad and your bf
0,wnevr i wana fal in love vth my book my bed fal in love vth me yen madodu nav pretsorginta nammanna pretsovru import alwa gud eveb
0,am go to take bath ill place the key in window
0,dear take care i am just reach home love you a lot
0,have you emigr or someth ok mayb number number wa a bit hope
0,olol i print out a forum post by a guy with the exact same prob which wa fix with a gpu replac hope they do not ignor that
0,we walk from my mom right on stagwood pas right on winterston left on victor hill address is lt gt
0,yo you at jp and hungri like a mofo
0,thi is all just creepi and crazi to me
0,pathaya enketa maraikara pa
0,even if he my friend he is a priest call him now
0,or remind me in a few hr
0,i had been hope i would not have to send you thi messag my rent is due and i do not have enough for it my reserv are complet gone it a loan i need and wa hope you could her the balanc is lt gt is there a way i could get that from you till mid march when i hope to pay back
0,hi happi new year i do not mean to intrud but can you pl let me know how much tuition you paid last semest and how much thi semest is thank
0,hello hun how ru it here by the way i am good been on number date with that guy i met in walkabout so far we have to meet up soon how is everyon el
0,lol i wa go to last month i cash some in but i left lt gt just in case i wa collect more dure the week becaus they announc it on the blog
1,good luck draw take place number th feb number good luck for remov send stop to number custom servic number
0,short but cute be a good person but do not tri to prove gud mrng
0,just have not decid where yet eh
0,ye watch footi but worri we are go to blow it phil nevil
0,uncl abbey happi new year abiola
0,now am free call me pa
0,r you say i should re order the slipper co i had to pay for return it
0,stop know me so well
0,good even thi is roger how are you
0,small problem in auction punj now ask tiwari
0,he tell not to tell ani one if so treat for me hi hi hi
0,that is cool i like your photo you are veri sexi
0,would you fuckin believ it they did not know i had thur pre book off so they re cancel me again that need to b sack
0,haha better late than ever ani way i could swing by
1,lookatm thank for your purchas of a video clip from lookatm you have been charg number p think you can do better whi not send a video in a mmsto number
0,i have been bar from all b and q store for life thi twat in orang dungere came up to me and ask if i want deck so i got the first punch in
0,so no messag had food
0,ok go to sleep hope i can meet her
0,can you let me know detail of fri when you find out co i am not in tom or fri mention chine thank
0,you are right i have now that i think about it
1,sexi sexi cum and text me i am wet and warm and readi for some porn you up for some fun thi messag is free recd msg number p inc vat number cancel text stop
0,not plan yet go to join compani on jan number onli don know what will happen after that
0,boy i love you grl hogolo boy gold chain kodstini grl agalla boy necklac madstini grl agalla boy hogli number mutai eerulli kodthini grl i love you kano
0,haha i heard that text me when you are around
0,i ll get there tomorrow and send it to you
0,sorri in meet i will call you later
0,yo howz you girl never rang after india l
0,yeah but which is wors for i
0,i tag my friend that you seem to count a your friend
0,long time you rememb me today
0,are you up for the challeng i know i am
0,how much did you are hdd case cost
0,mysteri solv just open my email and he is sent me anoth batch is not he a sweeti
0,i can not describ how lucki you are that i am actual awak by noon
0,cheer for the card is it that time of year alreadi
0,ugh hope the asu peopl do not randomli do a reformat
0,have not seen my facebook huh lol
0,mah b i will pick it up tomorrow
0,still otsid le you come number morrow maga
0,do you still have plumber tape and a wrench we could borrow
1,dear voucher holder to claim thi week offer at you pc plea go to link t c appli
0,it vl bcum more difficult
0,in meet da i will call you
0,k k then watch some film
0,doe cinema plu drink appeal tomo is a fr thriller by director i like on at mac at number number
0,so mani peopl seem to be special at first sight but onli veri few will remain special to you till your last sight maintain them till life end take cr da
0,good morn pooki pie lol hope i did not wake you up
0,mayb if you woke up befor fuck number thi would not be a problem
0,happi birthday to you dear with lot of love rakhesh nri
0,x number lt gt are you go to get that
0,i will lick up everi drop are you readi to use your mouth a well
0,and you will expect you whenev you text hope all goe well tomo
0,great p diddi is my neighbor and come for toothpast everi morn
0,i av a new number wil you onli use thi one ta
0,so it to be poke man everyday that they teach you in canada abi how are you just say hi
0,no de am see in onlin shop so that i ask
0,just curiou becaus my cuz ask what i wa up to
0,she is good how are you where r you work now
0,oh ye i have just been a littl under the weather so i have kind of been coccoon at home
0,thi phone ha the weirdest auto correct
0,oop my phone die and i did not even know yeah i like it better
0,she said do you mind if i go into the bedroom for a minut ok i sed in a sexi mood she came out number minut latr wid a cake n my wife
0,we got a divorc lol she s here
0,babe have you got enough money to pick up bread and milk and i will give you it back when you get home
0,i want snow it is just freez and windi
0,come to mahal bu stop lt decim gt
0,don know thi week i am go to tirunelvai da
0,me too babi i promis to treat you well i bet you will take good care of me
0,it like that hotel dusk game i think you solv puzzl in a area thing
1,thank for your rington order refer number x number your mobil will be charg number number should your tone not arriv plea call custom servic number
0,hi my love how goe that day fuck thi morn i woke and drop my cell on the way down the stair but it seem alright phew i miss you
0,well that must be a pain to catch
0,sorri da thangam it is my mistak
1,you are cash balanc is current number pound to maxim you are cash in now send collect to number onli number p messag cc number po box number number tcr w number
0,i feel like a dick becaus i keep sleep through your text and facebook messag sup you in town
0,no plm i will come da on the way
0,guess he want alon time we could just show up and watch when they do
0,height of recycl read twice peopl spend time for earn money and the same money is spent for spend time good morn keep smile
0,ye princess toledo
0,aight text me when you are back at mu and i will swing by need somebodi to get the door for me
0,good no swimsuit allow
0,am okay will soon be over all the best
0,a cute thought for friendship it not necessari to share everi secret with you are close frnd but watev you share should be true
0,pl accept me for one day or am beg you chang the number
0,squeeeeez thi is christma hug if you lik my frndshp den hug me back if you get number you r cute number you r luvd number you r so lucki none peopl hate you
0,it ok if anybodi ask about me you tel them p
0,funni fact nobodi teach volcano number erupt tsunami number aris hurrican number sway aroundn no number teach hw number choos a wife natur disast just happen
0,you go to ring thi weekend or wot
0,also track down ani lighter you can find
0,babe i need your advic
0,i will leav around four ok
0,come to medic colleg at number pm forward it da
0,k k it good when are you go
0,i can make lasagna for you vodka
0,who were those peopl were you in a tour i thought you were do that sofa thing you sent me your curiou sugar
