0,think actual talk call boss morn went place last year told could go get car fix cheaper kept tell today much hope would come back alway regret get number etc
0,will go app class
0,hang brother famili
0,reach number tell know
0,yeah would pretti much best case scenario
0,send naughti pix
1,xma new year eve ticket sale club day number till number pm thur fri sat night week sell fast
0,tyler get number th leav long number get like hour
0,prepar pound everi night
0,actual mobil full messag work onlin need send lt gt sent messag wil explain later
0,good even
0,home pleas call
0,mmmmm sooooo good wake word morn love mmmm fuck love lion devour kiss across sea
0,pleas inform applic airtel broadband process success instal happen within number day
0,happen dear silent tens
0,get number unless guy want come time sooner
0,cough noth
0,lol ok ill tri send warn sprint dead slow probabl get tomorrow
0,thank meet monday
1,rock yr chik get number filthi film xxx pic yr phone rpli filth number saristar ltd e number number yt number number p per number day stop number cancel
0,got like money lt gt get later though get whatev feel like
0,dad want talk apart got late start omw
0,love
0,lol still feel sick
0,eye philosophi
1,next month get upto number call number standard network charg number activ call number c wire number net number st number term pobox number number number uz cost number number min mobcudb
0,alreadi sabarish ask go
0,da vijay go talk jaya tv
0,lol know hey someon great inperson flea forum love
0,still chanc search hard get let tri
1,auction round number highest bid number next maximum bid number bid send bid e g number bid number number good luck
0,alway celebr ny famili
0,know taj mahal symbol love lesser known fact number mumtaz shahjahan number th wife number wife number shahjahan kill mumtaz husband marri number mumtaz die lt gt th deliveri number marri mumtaz sister question aris hell love great hari
0,ok come home vl nice meet v chat
0,sent de webadr gete salari slip
0,fine send greet
0,dint touch
0,yup leav right back soon
0,yeah sure leav min
0,one teach ship car
0,yeah confirm stay weekend
0,multipli number independ count decim point divis push decim place like show
0,love night wake see messag hope smile know great morn
0,right meanwhil project twin comin
0,sent maga money yesterday oh
1,hot n horni will live local text repli hear strt back number p per messag netcollex ltdhelpdesk number repli stop end
0,ride equal unev mani peski cyclist around time night
0,free give otherwis nalla adi entey nattil kittum
0,sent wife text buy tell relax go get wkend
0,much would cost hire hitman
0,good morn princess happi new year
0,aight head
0,know mood today
0,jay told alreadi
0,cp caus outag conserv energi
0,sure check happen around area
0,hey morn come ask pa
0,jordan got vote last nite
0,mean got epi fine
0,idea
0,pl come quick cannot bare
0,call unabl cal let us meet bhaskar deep
0,meet librari
0,k roommat also want dubsack anoth friend may also want plan bring extra tell know sure
0,enjoy watch play footbal basketbal anyth outdoor
0,pleas ask macho price rang want someth new use plu interfu blackberri bold lt gt bb
0,hey check da list da
0,meant apolog text get drug lt gt night
0,mean februari april get place stay hustl back forth audit season sinc sister move away harlem
0,damn poor zac stand chanc
0,want tel one thing mistak k messag sent
0,yeah right bring tape measur fri
0,head straight
0,thank princess sexi
0,oooh got plenti
0,big differ lt gt versu lt gt everi lt gt hr
0,make cri stuff happen top everyth els push edg underdtand often cri sorri sorri life
0,know hook mean right
0,realli skateboard despit fact get thrown wind bandag shit arm everi five minut
1,stop club tone repli stop mix see tone com enjoy html term club tone cost gbp number number week mfl po box number mk number number wt number number
0,sorri left phone upstair ok might hectic would bird one fell swoop date
0,thought see
0,carlo say pick later yeah set
0,hey babe friend cancel still visit
0,hmm ill think ok forgiven
0,hope get away number langport still town tonight
0,want send virtual hug need one
0,probabl still go stuff
0,issu right ill fix tomorrow
0,come peopl
0,senthil group compani apnt number pm
0,oh realli make air talent
0,studi free next weekend
0,wait come lt gt min
0,well great weekend
0,langport sorri probabl bed number pm suck ill xma go number sri lanka
0,frnd juz word mere relationship silent promis say wherevr whenevr forevr gudnyt dear
0,turn phone mom tell everyon cancer sister stop call hurt talk put see get home love
0,honey sweetheart darl sexi bun sugar plum loverboy miss boytoy smack ass go gym
0,thank love rock
0,yeah go come jay want drug
0,came look flat seem ok number away alot wiv work got woman come number number
0,moji inform save live thank
0,class
0,great attract brotha
1,promot number number award citi break could win number summer shop spree everi wk txt store number skilgm tsc number winawk age number number number perwksub
0,lol happen vega stay vega
0,dad say hurri hell
0,wake lt gt morn
0,get class bsn like lt gt minut know advis
0,great shoot big load get readi
0,meet lobbi
0,still come tonight
0,happen dear tell
0,sir wait call free pleas call
0,text finish long time ago shower er ything
0,hello per request lt gt rs number transfer
0,tirupur call da
0,luck number catch put
0,hey loverboy love tell look pictur ach feel leg fuck want need crave
0,boy sweet word left morn sigh goe day love start studi
0,ok good make money
0,read gud habit nan bari hudgi yorg pataistha ertini kano
0,aight still want get money
0,town v import
0,sorri pa knw ru pa
0,oh get paid outstand one commerci hasbro august made us jump mani hoop get paid still
0,late call tomorrow morn take care sweet dream ummifi bye
0,network technic support associ
0,go rip uteru
0,cool like swim pool jacuzzi hous
0,yeah gang readi
0,blank blank wat blank lol
0,noth spl wat whr ru
0,chikku nt yet ya free
0,aldrin rakhesh ex rtm pl call urgent
0,search number happi number main sourc unhappi accept life way come find happi everi moment live
0,guess could good excus lol
0,frnd neces life imagin urself witout frnd hw would feel colleg wat wth cell wat function thnk event esp care miss amp irrit number wrd dear love frnd wthout cannot live jst takecar goodmorn
0,old orchard near univ
0,number taco number raja burrito right
0,number get ok
0,street end librari walk
0,plz note anyon call mobil co amp ask type lt gt lt gt disconnect call coz iz attempt terrorist make use sim card itz confirmd nokia n motorola n verifi cnn ibn
0,stop get ice cream go back
0,stitch trouser
1,number number number tf number p
0,nah wednesday bring mini cheeto bag
0,nobodi name peni girl name stori add
0,aight let know go around usf
0,lip sync shangela
1,dear voucher holder number claim number st class airport loung pass use holiday voucher call number book quot number st class x number
0,buzz hey love think hope day goe well sleep miss babe long moment togeth love smile
0,earli
0,ya one slow poo
0,lol ouch wish would stay bit longer
0,god ask forgiv littl child gave love repli wonder fruit tree give hurt stone good night
0,join lt gt bu
0,ask keep one mayb get messag sent glo
0,k send lt gt min
0,would smoke help us work difficult time
0,ye mum lookin strong
0,sir goodmorn free call
0,love girl offic may wonder smile sore
0,hi wlcome back wonder got eaten lion someth noth much
0,uncl timi help clear car
0,came hostel go sleep plz call class hrishi
0,fishrman woke earli mrng dark wait amp found sack ful stone strtd throwin thm number sea number pass time atlast ju number stone sun rose amp found tht r nt stone diamond moral wake earli mrng good night
1,claim number shop spree call number mobstorequiz number ppm
0,dear friend sorri late inform today birthday love ar praveesh detail log face book see number lt gt miss delici treat
0,onlin transact
0,dear got train seat mine lower seat
0,let know need anyth els salad desert someth mani beer shall get
0,whore unbeliev
0,sure mean get made hold weed
0,love know feel make belli warm wish love shall meet dream ahmad ador kiss
1,twink bear scalli skin jock call miss weekend fun call number number p min number stop text call number nat rate
0,love want flood pretti pussi cum
0,hey angri repli dr
0,short cute good person tri prove gud noon
0,also rememb bead come ever
0,thread wishlist section forum peopl post nitro request start last page collect bottom
0,first time histori need comfort luxuri sold price india onion rs lt gt petrol rs lt gt beer rs lt gt shesil lt gt
0,actual nevermind got hella cash still lt gt ish
0,ok least armand still around
0,da happi sit togeth na
0,dude fake frnd got money tht reffer member wit mail link vl credit lt gt rs il geti lt gt rs draw acc wen lt gt rs
0,dude makin weirdi browni sister made awesom cooki took pic
0,pl restrict eat anythin like next two day
0,mm ask come enough
0,funer home audrey dad
0,aight text address
0,excel wish togeth right
0,yep fine number number number number ice age
0,pl beliv god jesu
0,yet chikku k wat tht guy stop irrit msging
0,long take get
0,number vivek
0,sorri brah finish last exam
0,got arrest possess shit lt time gt pm
0,right though give space want need realli start becom issu go suggest set definit move still greec mayb readi
0,normal
0,miss much despar record messag left day listen hear sound voic love
0,hi alway onlin yahoo would like chat someday
0,goodmorn grandfath expir leav today
0,yuou work get pc mom find spot would work need
0,sure see come bit
0,agre stop thinkin ipad pleas ask macho question
0,let us pool money togeth buy bunch lotto ticket win get lt gt get lt gt deal
0,think chennai forgot come auction
0,earli bird purchas yet
0,went pay rent go bank authoris payment
0,erm ill pick number number pm give enough time get park
0,howz pain come today said ystrday ice medicin
0,chile pleas lt decim gt hour drive come time sublet feb april audit season
0,ye amma life take lot turn sit tri hold steer
0,yeah thought let know anyth goin later
0,mmmm cannot wait lick
0,pl go today lt gt want excus
0,plz tell an bslvyl sent via fullonsm com
0,look forward sex cuddl two sleep
0,rounder requir
0,true k knw di lt gt
0,worri number day big lambu ji vl come til enjoy batchlor parti
1,free messag singl find partner area number real peopl wait chat send chat number cncl send stopc number number number per messag
0,ok part tomorrow
0,found differ farm shop buy chees way back call
0,yep like pink furnitur though
1,free messag rington link widel com index wml id number b number number ecef number ff number number first true number number jul number
0,custom place wil cal sir
1,oh god found number glad text back xafter msg cst std ntwk chg number number
0,pure heart person wonder smile make even enemi feel guilti enemi catch world smile goodmorn amp smiley sunday
0,theoret yeah could abl come
0,alright hook guy
0,know peopl still town
0,let math good
0,yeah usual guy town definit peopl around know
0,join today formal pl keep pray talk later
0,happi sad one thing past good morn
0,multimedia messag e mail
0,get messag
0,sorri sir call tomorrow senthil hsbc
0,need person give na
0,left vagu said would inform person account delay rent discuss hous agenc rent anoth place check onlin place around usc lt gt
0,gumbi special lt gt chees pizza money number know doin tonight
1,link pictur sent also use link
0,like person size
0,great aunt anniversari parti tarpon spring
0,cab avail pick drop door step
0,ok take care umma
0,unlimit text limit minut
1,doubl min number txt orang tariff latest motorola sonyericsson nokia bluetooth free call mobileupd number number call number optout hf number
0,problem spend lot qualiti time togeth
0,heard week
0,ye last practic
0,thank wonder
0,depend would like treat
0,right brah see later
1,want new video handset number anytim network min half price line rental camcord repli call number deliveri tomorrow
0,went fast asleep dear take care
0,mean fat head
0,sound like plan cardiff still still cold sit radiat
0,seriou like proper tongu
0,good wonder say hi smile cope long distanc
0,yeah whatev lol
0,wish think go snow much flurri usual get melt hit ground eek snow sinc lt gt even born
1,free rington repli real poli eg real number number pushbutton number dontcha number babygoodby number golddigg number webeburnin number st tone free number join number wk
0,oh realli perform write paper go movi home midnight huh
0,enough troubl sleep
0,lol realli need rememb eat drink appreci keep compani night babe smile
0,babe lost tri reboot
0,ye nigh cannot aha
0,nooooooo go bore death day cabl internet outag
0,amount get pl
0,playin space poker
0,need get
0,r give second chanc rahul dengra
0,yeah fact ask need anyth like hour ago much
0,daddi bb
1,free messag get gnarl barkley crazi rington total free repli go messag right
0,borderlin yeah whatev
0,gentl princess make sweet gentl love
0,sorri went bed earli nightnight
0,like think alway possibl pub later
0,hi dude hw r da reali mise today
1,refus loan secur unsecur get credit call free number number number text back help
0,probabl eat today think go pop weekend miss
0,one day train
0,could kiss feel next
0,nice day dear
0,sent lanr fakey eckankar detail mail box
0,dad back ph
0,ask say pleas messag
0,callin say hi take care bruv
0,turn heater heater set lt gt degre
0,thank messag realli appreci sacrific sure process direct pay find way back test tomorrow class wonder day
0,troubl class go well due dodgey one expect mine tomo see recoveri time place
0,night night see tomorrow
0,roger probabl go rem number
0,think girl propos today se bloodi funki shit fuck face asssssholeee
0,wish feel alon
0,reason team budget avail last buy unsold player base rate
1,ringtonek number
0,nationwid auto centr someth like newport road like
0,hey miss tm last night phone charg smile meet friend shortli
0,whatev juliana whatev want
1,rington club gr number new poli direct mobil everi week
0,hello sort town alreadi rush home eat nacho let know eta
0,dizzamn aight ask suitem get back
0,nimbomson yep phone know one obvious co real word
0,love cuddl want hold strong arm right
0,r contin
0,pay like lt gt yr difficult
0,k k give treat
0,go worri noth give money use
0,get gift year get anyth bad
0,well pattern emerg friend tell drive come smoke tell weed fiend make smoke much imped thing see hesit
0,ow dey paid number number thousad told would call
0,forgot work today want chat thing ok drop text free bore etc ring hope well nose essay xx
0,discuss mother ah
0,sorri text amp drive coher see twenti
1,receiv week tripl echo rington shortli enjoy
0,place get room cheap
0,eek lot time especi sinc american pie like number minut long stop sing
1,select stay number number top british hotel noth holiday valu number dial number claim nation rate call bx number sw number ss
0,univers southern california
0,pick rayan macleran
0,well ball time make call
0,lt gt mca conform
0,ye princess go make moan
0,lol ok rememb til last nite
0,anyway mani good even
0,cool text
0,sorri vikki watch olav mandara movi kano trishul theatr wit frnd
0,happi babe woo hoo parti dude
0,take italian food pretti dress panti
0,hold
0,flatter tell man mine two pint carlin ten minut pleas
0,hope scare
0,time get
0,liter bed like lt gt hour
0,ye reg ciao
0,mean websit ye
0,lol could starv lose pound end day
0,yeah impress got
0,ok ok take care understand
0,motiv behind everi dark shine light wait find behind everi best friend alway trust love bslvyl
0,ya ok dinner
0,slept time
0,make ne plan nxt wknd coz want us come ok
0,school start stay weather like food social support system like friend school thing import
0,ha ha nan yalrigu heltini iyo kothi chikku share mani thing wit far told bodi even utter word trust much tell other plz nxt time use word ok chikku b
0,noic text
1,week savamob member offer access call number detail savamob pobox number la number number wu number number week savamob offer mobil
0,aight set free think could text blake address occur quit sure thought
0,hi dear saw dear happi batteri low
0,age abj
0,prof pass paper sem congrat student enna kalaachutaarama prof gud mrng
0,kick coco
0,fyi go call sporad start like lt gt doin shit
1,tb persolvo chase us sinc sept number definit pay thank inform ignor kath manchest
0,ok call disturb one know avoid burden
1,loan purpos even bad credit tenant welcom call noworriesloan com number
0,actual exam harder nbme
0,lot sick thing go round take easi hope feel better soon lol
0,hey sathya till dint meet even singl time saw situat sathya
0,gam gone outstand inning
0,play smash bro lt gt religi
0,sir good morn hope good weekend call let know abl rais lt gt dad howev said would make rest avail mid februari amount still quit short hope would help good day abiola
0,hurri home soup done
0,good afternoon love good see word ym get tm smart move slave smile drink coffe await
0,let know
0,need stop go bed make fuck deal
0,love brother time talk english grin say hey muhommad penni say hello across sea
0,hey doc pl want get nice shirt hubbi nice fite one budget lt gt k help pl load card abi hw keep post love number mj
0,remain unconvinc elabor test willpow
0,life noth wen v get everyth life everyth wen v miss someth real valu peopl wil realiz absenc gud mrng
0,miss
0,ai answerin phone actual pretti reason hour sleepi
0,hey rite put number evey mnth
0,go bed prin
0,think thank see tomo
1,gsoh good spam ladi could b male gigolo number join uk fastest grow men club repli oncal mjzgroup number number stop repli stop messag number number rcvd
0,hav frnd name ashwini colleg
0,k number marrow come class
0,pl send address sir
0,want lick pussi
0,yo go still stock tomorrow today tri get dubsack
0,see probabl yeah
0,thought could go dinner treat seem ok
0,stand away heart ach without wonder crave
0,sorri never hear unless book one kind joke thet realli look skinni white girl one line much camera someth like cast look
0,sure thing big man hockey elect number go longer hour though
0,babe goe day miss alreadi love love kiss hope everyth goe well
0,doc prescrib morphin pain med enough wait mom bring med kick fast go tri later
0,cool want go kappa meet outsid mu
0,hey sexi bun told ador loverboy hope rememb thank sister law meatbal grin love babe
0,may b approv panalam post
1,spjanuari male sale hot gay chat cheaper call number nation rate number number p min cheap number number p min peak stop text call number number p min
0,workin get job
0,done mean
0,luck love someon fortun love one love miracl love person love anyon except gud nyt
1,freemsg today day readi horni live town love sex fun game netcollex ltd number p per messag repli stop end
0,yahoo boy bring perf legal
0,need say anyth know outsid
0,ever one foot
0,got lt gt
0,good need receipt well done ye pleas tell number could ring
0,beauti truth express face could seen everyon depress heart could understood love one gud ni number
0,infact happi new year see
1,simpson movi releas juli number name band die start film green day b blue day c red day send b c
0,shame mayb cld meet hr tomo
0,lol would despit cramp like girl
0,pl help tell sura expect batteri hont pl send messag download movi thank
1,pleas call amanda regard renew upgrad current mobil handset free charg offer end today tel number number number subject c
0,found way get anoth app phone eh go net cafe take job geeee need babe crave see
0,nanni address
1,want new video phone number anytim network min half price line rental free text number month repli call number free deliveri
0,yo call get chanc friend mine want ask big order
0,singl singl answer fight plu said broke repli
0,certainli put thing perspect someth like happen
0,felt convey reason ese
0,go got excit karaok type activ plan debat whether play footbal eve feel lazi though
0,told come wednesday
0,ok call mom instead fun
0,well desper call armand
0,work right
0,heard anyth answer text guess flake said jb fantast
0,mmmmmm love much ahmad wait year begin everi second take closer side happi new year love
0,pl full name joke school co fee univers florida seem actual lt gt k pl holla back
0,pl pl drink plenti plenti water
0,queen go royal wed
0,lag sad part keep touch thank skype
0,two team wait player
0,swhrt dey hope ok tot number day love n miss take care
0,ok da alreadi plan wil pick
0,realli need shit tomorrow know awak like number
0,good regist vote
0,hmm ok stay like hour co eye realli sore
0,dear got bu directli calicut
0,mm umma ask vava also come tell play later togeth
0,well gener price lt gt oz let know much want
0,moment day valu morn bring hope afternoon bring faith even bring love night bring rest wish find today good morn
0,lt gt w jetton ave forgot
0,use foreign stamp countri
0,sorri lot friend friend stuff talk actual guy want buy
1,cmon babe make horni turn txt fantasi babe hot sticki need repli cost number number number cancel send stop
0,wyli updat weed dealer carlo went freedom class lunsford
0,happi babi alright take job hope fine send kiss make smile across sea kiss kiss
0,enjoy semest take care brother
1,import inform number orang user number xxxxxx today lucki day number find log onto link fantast prizeawait
0,get door
0,let us use next week princess
0,want kfc tuesday buy number meal number gravi number mark number
0,da stupid da alway send like believ messag pandi mental
0,oi go ring
1,miss call alert number call left messag number
0,attend noth
0,dear sleep p
0,er mw fill tuth aight
0,offic around number pm go hospit
0,actual wait number week start put ad
0,yo around friend mine lookin pick later tonight
0,stupid auto correct phone
0,doubl evict week spiral michael good riddanc
0,world suffer lot violenc bad peopl silenc good peopl gud night
0,ok cool either raglan rd edward rd behind cricket ground give ring closebi see tuesday
0,buy one egg da pleas
0,start skye
0,bookedth hut also time way
0,sever sir
0,love hope anyth drastic dare sell pc phone
1,freemsg record indic may entitl number pound accid claim free repli ye messag opt text stop
0,life style garment account pleas
0,lol wtf random way lunch break
0,lay man let know miss thought great day send bimbo ugo number ill appreci safe
0,detroit home snow enjoy
1,show colour euro number number number number offer get england flag number lion tone phone click follow servic messag info
0,aight chillin friend room text way
0,well welp sort semiobscur internet thing
0,loosu go hospit de let careless
0,much eighth
0,omg joanna freak look thru friend find photo ask stuff myspac even log like year
0,send birthdat month year tel life partner name method calcul repli must
0,cloth jewelri trip
1,block breaker come delux format new featur great graphic mobil buy number repli get bbdelux take challeng
0,aah cuddl would lush would need lot tea soup kind fumbl
1,import inform number orang user today lucki day number find log onto link fantast surpris await
0,plan famili set stone
0,pl forget studi
0,never believ actual got taunton wow
0,broke list reason nobodi town tell sarcast faggi
0,lt decim gt common car better buy china asia find less expens holla
0,greatest test courag earth bear defeat without lose heart gn tc
0,great hope use connect mode men also co never know old friend lead today
0,kind miss train co asthma attack nxt one half hr drive sure park
0,ball move lot spin last difficult bat
0,pleas send aunti number
0,glad follow dream
0,wn r hurt prsn close number fight wit dem coz somtim di fight save relat bt quiet leav nothin relat gud eveb
0,scienc tell chocol melt sunlight pleas walk sunlight bcoz want loss sweet friend
0,ye come nyc audiit tri reloc
0,pock
0,congrat great want tell tell score co might make relax motiv thank share
0,wud never mind miss need wil realli hurt wen need amp tell take care
0,hey mr name bill brison book one languag word
0,okay good problem thanx
0,inform ikea spell cap yell thought left sit bed among mess came said go got home class pleas tri bullshit make want listen less
0,best watch say get drunk motherfuck
1,thesmszon com let us send free anonym mask messag send messag see potenti abus
0,erm woodland avenu somewher get parish magazin telephon number
0,ta job avail let know pleas co realli need start work
0,good good billi mate gone jog enjoy concert
0,yo come carlo soon
0,guess useless call number someth import
0,ha ha pop loo hello ed hello
0,dint tell anyth angri told abi
0,happen r number waxsto wat want come ill get medic insur abl deliv basic care current shop right medic insur give til friday morn see major person guid right insur
0,well babe swollen gland throat end
0,captain room
0,speak bcaz mobil problem listen listen voic call later
0,hiya stu wot number much trubl home moment evon hate even wot hell av done tell text bck pleas love dan
0,take mokka player
0,still play gautham
0,hey mr go sea view coupl gay mean game give bell ya finish
0,k jason say go around around lt gt
0,sorri abl get see morn
0,aight well keep inform
0,search good dual sim mobil pa
0,seem unnecessarili hostil
0,dude got haircut breezi
0,number appl day doctor number tulsi leaf day cancer number lemon day fat number cup milk day bone problm number litr watr day diseas snd th number care
0,thought king hill thing
0,also tell said happi birthday
0,boo time get suppos take shop today
0,fyi take quick shower epsilon like lt gt min
0,tuesday night r number real
0,ye appt
0,got outta class go go gym
0,ha would say read anyth way seem like number judgement save friday pub
0,valentin game send di messag friend number answer r someon realli love que colour suit best
0,hi ask waheeda fathima leav
0,still around could use half number th
0,give us back id proof lt gt rs allow work come home within day
0,ye rent expens way save
0,pain dear r smile
0,fun fact although would think armand would eventu build toler shit consid much smoke get fuck like number hit
0,great send account number
