1,you are cash balanc is current number pound to maxim you are cash in now send cash to number onli number p messag cc number hg suit number number land row w number j number hl
1,great news call freefon number to claim your guarante number cash or number gift speak to a live oper now
1,you have won a guarante number cash or a number prize to claim yr prize call our custom servic repres on
1,number between number am number pm cost number p
1,ye the onli place in town to meet excit adult singl is now in the uk txt chat to number now number p messag
0,stupid it not possibl
0,she told to hr that he want post in chennai becaus i am work here
1,mobil club choos ani of the top qualiti item for your mobil number cfca number a
0,when are you guy leav
0,not abl to do anyth
0,thi weekend is fine an excus not to do too much decor
0,sorri i miss you babe i wa up late and slept in i hope you enjoy your drive lesson boytoy i miss you too tea kiss
0,now project pa after that onli i can come
1,money i have won wine number number wot do i do next
0,sure whenev you show the fuck up gt
0,that wa random saw my old roomat on campu he graduat
0,men alway need a beauti intellig care love adjust cooper wife but the law allow onli one wife
0,that suck so what do you got plan for your yo valentin i am your yo valentin are not i
0,just got part nottingham number hr number mile good thing i love my man so much but onli do number mph hey ho
0,what to think no one say clearli ok leav no need to ask her i will go if she come or not
0,hi good mornin thanku wish you d same
0,actual i decid i wa too hungri so i have not left yet v
1,i want some cock my hubbi is away i need a real man number satisfi me txt wife to number for no string action txt stop number end txt rec number number ea otbox number la number number w
0,understand hi loss is my gain so do you work school
0,hiya probabl come home weekend after next
0,do not forget though that i love you and i walk besid you watch over you and keep your heart warm
0,i wish thing were differ i wonder when i will be abl to show you how much i valu you pl continu the brisk walk no drug without askin me plea and find thing to laugh about i love you dearli
0,ok both our day so what are you make for dinner tonit am i invit
1,gr number new servic live sex video chat on your mob see the sexiest dirtiest girl live on you are phone number detail text horni to number to cancel send stop to number
0,never blame a day in you are life good day give you happi bad day give you experi both are essenti in life all are god bless good morn
0,normal i use to drink more water daili
0,dare i ask ani luck with sort out the car
0,parti is at my place at usf no charg but if you can contribut in ani way it is greatli appreci and yeah we got room for one more
0,urgh coach hot smell of chip fat thank again especi for the duvet not a predict text word
0,hiya how wa last night i have been naughti and bought myself cloth and veri littl readi for more shop though what kind of time do you want to meet
1,freemsg hi babi wow just got a new cam mobi want to c a hot pic or fanci a chat i am w number in number utxt rpli chat to number hlp number msg number p number rcv
0,i have been tri to reach him without success
0,when you and derek done with class
0,never tri alon to take the weight of a tear that come out of you are heart and fall through you are eye alway rememb a stupid friend is here to share bslvyl
0,hey mate spoke to the mag peopl we are on the is deliv by the end of the month deliv on the number th sept talk later
0,hope you are have a good week just check in
0,haha my friend tyler liter just ask if you could get him a dubsack
0,great have a safe trip do not panic surrend all
0,symptom when you are in love number you like listen song number you get stop where you see the name of your belov number you will not get angri when your
0,tri to do someth dear you read someth for exam
0,number wonder in my world number th you number th you are style number th you are smile number th you are person number rd you are natur number nd you are sm and number st you are love friendship good morn dear
0,gettin rdi to ship comp
0,i am in hospit da i will return home in even
0,think da you wil do
0,i am awak oh what is up
0,good afternoon my boytoy how goe that walk here and there day did you get that polic abstract are you still out and about i wake and miss you babe
0,how much you tri to get
0,come around lt decim gt pm vikki i am otsid nw il come by tht time
0,tell me again what your address is
0,honeybe said i am d sweetest in d world god laugh amp said wait you havnt met d person read thi messag moral even god can crack joke gm gn ge gn
0,should i buy him a blackberri bold number or torch should i buy him new or use let me know plu are you say i should buy the lt gt g wifi ipad and what are you say about the about the lt gt g
0,but you were togeth so you should be thinkin about him
0,hiya how is it go in sunni africa hope you r avin a good time give that big old silver back a big kiss from me
0,at what time should i come tomorrow
0,omg how did you know what i ate
0,but your not here
0,no plan yet what are you do
0,hi my engag ha been fixd on lt gt th of next month i know it realli shock bt hmm njan vilikkam t w al of a sudn
0,not cours onli math one day one chapter with in one month we can finish
0,wow did not think it wa that common i take it all back you are not a freak unless you chop it off
0,noooooooo plea last thing i need is stress for onc in your life be fair
1,you have a secret admir who is look number make contact with you find out who they r reveal who think you are so special call on number stopsm number ppm
0,i will see if i can swing by in a bit got some thing to take care of here firsg
0,i want to wish you a happi new year and i want to talk to you about some legal advic to do with when gari and i split but in person i will make a trip to ptbo for that i hope everyth is good with you babe and i love ya
0,have you not finish work yet or someth
0,tomorrow i am not go to theatr so i can come wherev you call me tell me where and when to come tomorrow
0,i had a good time too it nice to do someth a bit differ with my weekend for a chang see ya soon
0,yo sorri wa in the shower sup
0,carlo is down but i have to pick it up from him so i will swing by usf in a littl bit
0,full heat pa i have appli oil pa
0,have you laid your airtel line to rest
0,hi did you decid wot number get number hi birthday if not ill prob ju get him a voucher frm virgin or sumf
1,freemsg txt call to no number claim your reward of number hour talk time to use from your phone now subscrib number gbp mnth inc number hr number stop txtstop
0,and i do not plan on stay the night but i probabl will not be back til late
0,i need an number th but i am off campu atm could i pick up in an hour or two
0,been run but onli manag number minut and then need oxygen might have to resort to the roller option
0,we live in the next lt gt min
0,y de ask like thi
0,just glad to be talk to you
0,sorri da i gone mad so mani pend work what to do
0,how much you got for clean
0,how is my favourit person today r you workin hard could not sleep again last nite nearli rang you at number number
1,sunshin quiz win a super soni dvd record if you cannam the capit of australia text mquiz to number b
0,good do you think you could send me some pix i would love to see your top and bottom
0,sorri i will call later in meet
0,thi is a long fuckin showr
0,receiv understood n act upon
0,they final came to fix the ceil
0,you need my presnt alway bcz you cannot mi love jeevithathil irulina neekunna prakasamanu sneham prakasam ennal prabha that mn prabha is love got it do not mi me
0,i am on the bu love you
0,lol i knew that i saw him in the dollar store
0,onli saturday and sunday holiday so it veri difficult
0,everybodi had fun thi even miss you
0,got hella ga money want to go on a grand natur adventur with galileo in a littl bit
0,i am in a meet call me later at
0,oh wow that is gay will firmwar updat help
0,these will not do have to move on to morphin
0,k k pa had your lunch aha
0,oh ho is thi the first time you use these type of word
0,captain vijaykanth is do comedi in captain tv he is drunken
0,of cours i guess god is just got me on hold right now
0,do you hide anythi or keep distanc from me
1,you are be rip off get your mobil content from www clubmobi com call number poli true pix rington game six download for onli number
0,did you got that person stori
0,are you plan to come chennai
1,we tri to contact you re your repli to our offer of a video phone number anytim ani network min half price line rental camcord repli or call number
0,god creat gap btwn you are finger so dat sum number vri special will fill those gap by hold you are hand now plz do not ask y he creat so much gap between leg
0,we are okay go to sleep now later
0,plea protect yourself from e threat sib never ask for sensit inform like password atm sm pin thru email never share your password with anybodi
0,final it ha happen aftr decad beer is now cheaper than petrol the gover expect u to drink but do not drive
0,lol ye but it will add some spice to your day
0,hope you are have a great day
0,our prasanth ettan mother pas away last night just pray for her and famili
0,k i will work someth out
1,privat your number account statement for show number un redeem s i m point call number identifi code number expir number number number
0,thi messag is from a great doctor in india number do not drink appi fizz it contain cancer caus age
0,i cannot pick the phone right now pl send a messag
0,you call him and tell now infront of them call him now
0,ladi first and genu second k
0,no ye plea been swim
0,not tel softwar name
0,i send the print out da
0,when i wa born god said oh no anoth idiot when you were born god said oh no competit who knew one day these two will becom freind forev
0,i did not get you are full messag sometext is miss send it again
0,probabl not i am almost out of ga and i get some cash tomorrow
1,custom servic announc we recent tri to make a deliveri to you but were unabl to do so plea call number to re schedul ref number
1,hi babe it chloe how r you i wa smash on saturday night it wa great how wa your weekend you been miss me sp visionsm com text stop to stop number p text
0,it is a good thing i am now get the connect to bw
0,sri da jst nw onli i came to home
0,that is cool he will be here all night let me know when you are around
0,are you stay in town
0,haha yeah number oz is kind of a shitload
0,ok you can take me shop when you get paid d
0,my life mean a lot to me not becaus i love my life but becaus i love the peopl in my life the world call them friend i call them my world ge
0,alright we will bring it to you see you in like lt gt min
0,but pl do not play in other life
0,hmmm but you should give it on one day
0,did not tri g and i decid not to head out
0,surli ill give it to you while come to review
0,by march end i should be readi but will call you for sure the problem is that my capit never complet how far with you how is work and the ladi
0,tessi pl do me a favor pl convey my birthday wish to nimya pl dnt forget it today is her birthday shija
0,pl give her the food prefer pap veri slowli with load of sugar you can take up to an hour to give it and then some water veri veri slowli
1,urgent your mobil no number wa award a number number bonu caller prize on number number number thi is our number nd attempt to contact you call number number number box number qu
0,a guy who get use but is too dumb to realiz it
0,okey dokey i will be over in a bit just sort some stuff out
0,don no da what is you plan
0,ye fine
0,i like the new mobil
0,mmmmmmm snuggl into you deep content sigh whisper i fuck love you so much i can bare stand it
0,hey anyway i have to
0,did you say bold then torch later or one torch and number bold
0,haha awesom i might need to take you up on that what you doin tonight
0,ya i knw you vl giv it ok thank kano anyway enjoy wit you are famili wit number st salari
0,that is cool princess i will cover your face in hot sticki cum
0,big brother is realli scrape the barrel with thi shower of social misfit
0,s number min to go for lunch
0,hey what happen you switch off you are cell d whole day thi is not good now if you do care give me a call tomorrow
0,k will do addi amp i are do some art so i will be here when you get home
0,my uncl in atlanta wish you guy a great semest
0,i am home my love if your still awak love kiss
1,free game get rayman golf number free from the o number game arcad number st get you are game set repli post then save activ number press number key for arcad termsappli
0,there will be a minor shindig at my place later tonight you interest
0,jason say it is cool if we pick some up from hi place in like an hour
1,had your mobil number mth updat to the latest camera video phone for free keep you are same number get extra free min text text ye for a call
0,i career tel have ad you a a contact on indyarock com to send free sm to remov from phonebook sm no to lt gt
0,i do not know ask to my brother noth problem some thing that just i told
0,k eng rock in ash
0,good morn my dear shijutta have a great amp success day
0,oh k after that placement there ah
0,not for posse especi not first offens
0,nt onli for drive even for mani reason she is call bbd tht it chikku then hw about dvg cold heard tht vinobanagar violenc hw is the condit and hw ru ani problem
0,i bought the test yesterday it someth that let u you know the exact day you ovul when will get number u in about number to number wk but pl pl do not fret i know you r worri pl relax also is there anyth in you are past histori you need to tell me
0,we have pizza if you want
0,i keep see weird shit and bein all woah then realis it is actual reason and i am all oh
0,mani more happi return of the day i wish you happi birthday
0,ya veri nice be readi on thursday
0,when you just put in the sign choos my number and the pin will show right
0,the beauti of life is in next second which hide thousand of secret i wish everi second will be wonder in you are life gud n number
0,if you are still up mayb leav the credit card so i can get ga when i get back like he told me to
1,your weekli cool mob tone are readi to download thi week new tone includ number crazi frog axel f number akon lone number black eye do not p more info in n
0,well boy am i glad g wast all night at applebe for noth
1,cashbin co uk get lot of cash thi weekend www cashbin co uk dear welcom to the weekend we have got our biggest and best ever cash give away these
0,do not make life too stressful alway find time to laugh it may not add year to your life but sure add more life to you are year gud ni number swt dream
0,hey look like i wa wrong and one of the kappa guy number is still on my phone if you want i can text him and see if he is around
1,thank number your continu support your question thi week will enter you in number our draw number number cash name the new u presid txt an to number
0,i am home doc gave me pain med say everyth is fine
0,prepar to be pleasur
0,hi technic support provid assist to u custom through call and email
0,if you text on your way to cup stop that should work and that should be bu
0,when is your radio show
1,your uniqu user id is number for remov send stop to number custom servic number
0,i am not sure if it still avail though
0,watev relat you built up in di world onli thing which remain atlast iz lonlin with lotz n lot memori feel
0,hi i got the money da
0,hi mobil no lt gt ha ad you in their contact list on www fullonsm com it s a great place to send free sm to peopl for more visit fullonsm com
0,so mani peopl seem to be special at first sight but onli veri few will remain special to you till your last sight maintain them till life end sh ja
0,sorri complet forgot will pop them round thi week if your still here
0,o we cannot see if we can join deni and mina or doe deni want alon time
0,sen told that he is go to join hi uncl financ in cbe
0,call me i am senthil from hsbc
0,especi sinc i talk about boston all up in my person statement lol i would have chang that if i had realiz it said nyc it say boston now
0,inde and by the way it wa either or not both
0,holi live christ what is take you so long
0,we are on the opposit side from where we drop you off
0,send me your resum
0,sorri that wa my uncl i ll keep in touch
0,saw guy and doll last night with patrick swayz it wa great
1,santa call would your littl one like a call from santa xma eve call number to book you time call number number ppm last number min number s t c www santacal com
0,just come home i do not want you to be miser
0,i do not know whi she s not get your messag
0,it cool but tyler had to take off so we are go to buy for him and drop it off at hi place later tonight our total order is a quarter you got enough
0,the guy at the car shop who wa flirt with me got my phone number from the paperwork and call and text me i am nervou becaus of cours now he may have my address should i call hi bos and tell him know thi may get him fire
0,revers is cheat that is not mathemat
0,how do you plan to manag that
0,er hello thing did not quit go to plan is limp slowli home follow by aa and with exhaust hang off
0,sorri for the delay ye master
1,privat your number account statement for number number show number unredeem bonu point to claim call number identifi code number expir number number number
0,what is up my own oga left my phone at home and just saw you are messag hope you are good have a great weekend
0,do not worri though i understand how import it is that i be put in my place with a poorli thought out punish in the face of the worst thing that ha ever happen to me brb go to go kill myself
0,honey can you pl find out how much they sell predict in nigeria and how mani time can it be use it veri import to have a repli befor monday
0,fyi i am at usf now swing by the room whenev
0,i can call in lt gt min if that is ok
0,ummmmmaah mani mani happi return of d day my dear sweet heart happi birthday dear
0,anyth is valuabl in onli number situat first befor get it second after loo it
0,me too mark is take forev to pick up my prescript and the pain is come back
1,check out choos your babe video sm shsex netun fgkslpopw fgkslpo
0,i am good i have been think about you
1,you r a winner you ave been special select number receiv number cash or a number holiday flight inc speak to a live oper number claim number p min number
0,
0,not thought bout it drink in tap spile at seven is that pub on ga st off broad st by canal ok
0,i am go to sleep i am tire of travel
0,haha just what i wa thinkin
0,lol no just tri to make your day a littl more interest
0,how long befor you get repli just defer admiss til next semest
0,the word checkmat in chess come from the persian phrase shah maat which mean the king is dead goodmorn have a good day
0,po de no need job aha
0,rat hey did you ever vote for the next theme
1,new mobil from number must go txt nokia to no number collect your today from onli number www number tc biz number optout number number gbp mtmsg number txtauction
0,i hope your pee burn tonit
0,yay can not wait to parti togeth
0,photoshop make my comput shut down
0,all boy made fun of me today ok i have no problem i just sent one messag just for fun
0,that is one of the issu but california is okay no snow so it manag
0,awesom that go to be soon or later tonight
0,i need detail about that onlin job
0,miss you too pray inshah allah
0,pl help me tell ashley that i cannot find her number oh
0,i am in escap theatr now go to watch kavalan in a few minut
0,s thi will increas the chanc of win
0,either way work for me i am lt gt year old hope that doe not bother you
0,mayb you should find someth el to do instead
0,gain the right of a wife do not demand it i am tri a husband too let u see
0,i like your new hous
0,i am fine hope you are also
0,also north carolina and texa atm you would just go to the gre site and pay for the test result to be sent
0,ye babi i need to stretch open your pussi
0,thank and or bomb and date a my phone want to say
0,hey a guy i know is breath down my neck to get him some bud anyway you would be abl to get a half track to usf tonight
0,respons is one of d power weapon number occupi a place in other heart so alway give respons number who care number you gud night swt dream take care
0,nokia phone is lovli
1,free messag thank for use the auction subscript servic number number p msgrcvd number skip an auction txt out number unsubscrib txt stop customercar number
0,sorri da today i will not come to play i have drive cla
0,i am realli sorri i lit your hair on fire
0,oh shit i thought that wa your trip loooooool that just make so much more sen now grin and the sofa refer wa the sleep on a couch link you sent me wa not that how you went on your trip oh and did not your babe go with you for that celebr with your rent
0,okey dokey swashbuckl stuff what oh
0,watch cartoon listen music amp at eve had to go templ amp church what about you
0,number tension face number smile face number wast face number innoc face number terror face number cruel face number romant face number lovabl face number decent face lt gt joker face
0,dip is cell dead so i m come with him you better respond el we shall come back
0,well you know what i mean text
0,lol oop sorri have fun
0,wat happen to the cruis thing
0,the world is most happiest frnd never have the same charact dey just have the best understand of their differ
0,yeah just open chat and click friend list then make the list easi a pie
0,alright tyler is got a minor crisi and ha to be home sooner than he thought so be here a soon a possibl
0,when where do i pick you up
0,new theori argument win d situat but lose the person so do not argu with you are friend just kick them amp say i am alway correct
0,for mani thing it an antibiot and it can be use for chest abdomen and gyna infect even bone infect
0,poor girl can not go one day lmao
0,or just do that number time
0,you have to pl make a note of all she s expo to also find out from her school if anyon el wa vomit is there a dog or cat in the hous let me know later
0,japanes proverb if one can do it you too can do it if none can do it you must do it indian version if one can do it let him do it if none can do it leav it and final kerala version if one can do it stop him do it if none can do it make a strike against it
0,sound like there could be a lot of time spent in that chastiti devic boy grin or take your beat like a good dog go to loung in a nice long bath now
0,it wors if if use half way then stop it better for him to complet it
0,miser they do not tell you that the side effect of birth control are massiv gut wrench cramp for the first number month i did not sleep at all last night
0,send me the new number
0,convey my regard to him
1,want the latest video handset number anytim ani network min half price line rental repli or call number for deliveri tomorrow
0,number and half year i miss your friendship
0,oh for fuck is sake she is in like tallahasse
0,haha that wa the first person i wa go to ask
1,free polyphon rington text super to number to get your free poli tone of the week now number sn pobox number nr number number z subscript number pw
0,no i did not mean to post it i wrote it and like so mani other time i have ritten stuff to you i let it sit there it wa what i wa feel at the time i wa angri befor i left i hit send then stop it wa not there i check on my phone when i got to my car it wa not there you said you did not sleep you were bore so whi would not that be the time to clean fold laundri etc at least make the bed
0,will you come onlin today night
0,then anyth special
0,i am in solihul do you want anyth
0,will do have a good day
0,love that holiday monday feel even if i have to go to the dentist in an hour
0,i am on the way to tirupur
1,goal arsen number henri number v liverpool number henri score with a simpl shot from number yard from a pas by bergkamp to give arsen a number goal margin after number min
0,you have alreadi got a flaki parent it isnot suppos to be the child is job to support the parent not until they are the ride age anyway i am suppos to be there to support you and now i have hurt you unintent but hurt nonetheless
0,we took hooch for a walk toaday and i fell over splat graze my knee and everyth should have stay at home see you tomorrow
0,just drop them off omw back now
0,sit in mu wait for everyon to get out of my suit so i can take a shower
0,re your call you did not see my facebook huh
0,g say you never answer your text confirm deni
0,it so common hearin how r you wat r you do how wa you are day so let me ask you someth differ did you smile today if not do it now gud evng
0,hi dear call me it urgnt i do not know what is your problem you do not want to work or if you have ani other problem at least tell me wate for your repli
0,oh ye whi is it like tortur watch england
0,want to do some art d
0,just hope that wa not too piss up to rememb and ha gone off to hi sister or someth
1,hi the sexychat girl are wait for you to text them text now for a great night chat send stop to stop thi servic
0,good morn my boytoy how is those yummi lip where is my sexi bun now what do you do do you think of me do you crave me do you need me
0,match start india lt gt for number
0,onc free call me sir
0,hey do you want anyth to buy
0,hey babe how is it go did you ever figur out where your go for new year
0,k k congratul
0,g want to know where the fuck you are
0,tomarrow i want to got to court at lt decim gt so you come to bu stand at number
0,omg you can make a wed chapel in frontiervil whi do they get all the good stuff
0,check mail i have mail varma and kept copi to you regard membership take care insha allah
0,wrong phone thi phone i answer thi one but assum the other is peopl i do not well
