0,thi is hope you enjoy your game yesterday sorri i have not been in touch but pl know that you are fondli bein thot off have a great week abiola
0,omg i want to scream i weigh myself and i lost more weight woohoo
0,there gener is not one it is an uncount noun you in the dictionari piec of research
0,it is realli get me down just hang around
1,orang custom you may now claim your free camera phone upgrad for your loyalti call now on number number number offer end number thmarch t c is appli opt out availa
0,give me a few wa lt gt minut ago
0,appt is at lt time gt am not my fault you do not listen i told you twice
1,you have won a guarante number award or even number cashto claim you are award call free on number number number stop getstop on number php rg number number jx
0,k i will be there befor number
0,i dled number d it veri imp
0,sure but make sure he know we ai not smokin yet
0,boooo you alway work just quit
0,i am take half day leav bec i am not well
0,ugh i do not want to get out of bed it is so warm
0,s s nervou lt gt
0,so there is a ring that come with the guy costum it is there so they can gift their futur yowif hint hint
1,you were outbid by simonwatson number on the shinco dvd plyr number bid again visit sm ac smsreward number end bid notif repli end out
0,where is my boytoy i miss you what happen
0,he ha lot of use one babe but the model doe not help youi have to bring it over and he will match it up
0,also are you bring galileo or dobbi
0,then whi you not respond
0,good afternoon starshin how is my boytoy doe he crave me yet ach to fuck me sip cappuccino i miss you babe tea kiss
0,on the road so cannot txt
1,smsservic for yourinclus text credit pl goto www comuk net login number qxj number unsubscrib with stop no extra charg help number comuk number cm number number ae
0,hmm bit and piec lol sigh
0,hey you got ani mail
0,sorri light turn green i meant anoth friend want lt gt worth but he may not be around
0,thank for yesterday sir you have been wonder hope you enjoy the burial mojibiola
1,dear voucher holder to claim thi week offer at you pc plea go to link t c appli to stop text txt stop to number
0,thank you so much when we skype wit kz and sura we did not get the pleasur of your compani hope you are good we have given you ultimatum oh we are countin down to aburo enjoy thi is the messag i sent day ago
0,sure result will offer
0,good morn my dear have a great amp success day
1,do you want number anytim ani network min number text and a new video phone for onli five pound per week call number or repli for deliveri tomorrow
0,sir i have been late in pay rent for the past few month and had to pay a money lt gt charg i felt it would be inconsider of me to nag about someth you give at great cost to yourself and that is whi i did not speak up i howev am in a recess and will not be abl to pay the charg thi month henc my askin well ahead of month is end can you plea help thank
1,we tri to contact you re our offer of new video phone number anytim ani network min half price rental camcord call number or repli for deliveri wed
1,last chanc number claim you are number worth of discount voucher text ye to number now savamob member offer mobil t c number number number sub number remov txt x or stop
0,pl send me a comprehens mail about who i am pay when and how much
0,our prashanthettan is mother pas away last night pray for her and famili
0,k k when are you go
0,meanwhil in the shit suit xavier decid to give u lt gt second of warn that samantha wa come over and is play jay is guitar to impress her or some shit also i do not think doug realiz i do not live here anymor
0,my stomach ha been thru so much trauma i swear i just can not eat i better lose weight
0,i am in offic what is the matter messag me now i will call you at break
0,yeah there is bare enough room for the two of u x ha too mani fuck shoe sorri man see you later
0,i am real babi i want to bring out your inner tigress
0,no da if you run that it activ the full version da
0,stop the stori i have told him i have return it and he is say i should not re order it
0,go to take your babe out
0,hai ana tomarrow am come on morn lt decim gt ill be there in sathi then we ll go to rto offic repli me after came to home
0,spoon it is then okay
0,did he just say somebodi is name tampa
0,in work now go have in few min
0,your brother is a geniu
0,sorri i guess whenev i can get a hold of my connect mayb an hour or two i will text you
0,did you find out what time the bu is at coz i need to sort some stuff out
0,dude i have been see a lotta corvett late
0,same here but i consid wall and bunker and shit import just becaus i never play on peac but i guess your place is high enough that it do not matter
1,privat your number account statement for number xxxxxx show number un redeem s i m point call number identifi code number expir number number number
1,hello we need some posh bird and chap to user trial prod for champney can i put you down i need your address and dob a soon a possibl ta r
1,what do you want for xma how about number free text messag a new video phone with half price line rental call free now on number number to find out more
0,well am offici in a philosoph hole so if you want to call am at home readi to be save
0,it go good no problem but still need littl experi to understand american custom voic
0,i will text you when i drop x off
0,ugh it been a long day i am exhaust just want to cuddl up and take a nap
0,talk with yourself atleast onc in a day otherwis you will miss your best friend in thi world shakespear shesil lt gt
0,are you in castor you need to see someth
1,you have a secret admir who is look number make contact with you find out who they r reveal who think you are so special call on number
1,you have a secret admir who is look number make contact with you find out who they r reveal who think you are so special call on number stopsm number
1,remind you have not download the content you have alreadi paid for goto link mymobi tv to collect your content
0,see i knew give you a break a few time woul lead to you alway want to miss curfew i wa go to gibe you til one but a midnight movi is not go to get out til after number you need to come home you need to getsleep and if anyth you need to b studdi ear train
0,i love to give massag i use lot of babi oil what is your fave posit
0,dude we should go sup again
0,yoyyooo you know how to chang permiss for a drive in mac my usb flash drive
0,gibb unsold mike hussey
0,i like to talk pa but am not abl to i do not know y
0,you unbeliev faglord
0,wife how she knew the time of murder exactli
0,whi do you ask princess
0,i am great princess what are you think about me
0,nutter cutter ctter cttergg cttargg ctargg ctagg ie you
0,doe not g have class earli tomorrow and thu should not be tri to smoke at lt gt
0,superb thought be grate that you do not have everyth you want that mean you still have an opportun to be happier tomorrow than you are today
0,i am use to it i just hope my agent do not drop me sinc i have onli book a few thing thi year thi whole me in boston them in nyc wa an experi
0,thursday night yeah sure thing we will work it out then
0,probabl money worri thing are come due and i have sever outstand invoic for work i did two and three month ago
0,how is it possibl to teach you and where
0,i wonder if your phone batteri went dead i had to tell you i love you babe
0,love smell on thi bu and it ai not tobacco
0,we are all get worri over here derek and taylor have alreadi assum the worst
0,hey what is up charl sorri about the late repli
0,i ll give her onc i have it plu she said grinul greet you whenev we speak
0,white fudg oreo are in store
1,januari male sale hot gay chat now cheaper call number nation rate from number number p min cheap to number number p min peak to stop text call number number p min
0,my love how come it took you so long to leav for zaher is i got your word on ym and wa happi to see them but wa sad you had left i miss you
0,i am sorri it hurt you
0,can not i feel nauseou i am so piss i did not eat ani sweet all week becaus today i wa plan to pig out i wa diet all week and now i am not hungri
0,call me da i am wait for your call
0,i could ask carlo if we could get more if anybodi el can chip in
0,wa actual about to send you a remind today have a wonder weekend
0,when peopl see my msg they think iam addict to msging they are wrong bcoz they don t know that iam addict to my sweet friend bslvyl
0,do not talk to him ever ok it my word
0,when you wana see it then
0,on ma way to school can you pl send me ashley is number
0,it shall be fine i have avalarr now will hollalat
0,she went to attend anoth two round today but still did t reach home
0,actual i delet my old websit now i m blog at magicalsong blogspot com
0,k wait chikku il send aftr lt gt min
0,but i am on a diet and i ate number too mani slice of pizza yesterday ugh i am alway on a diet
0,k i will give my kvb acc detail
0,oh all have to come ah
1,money you r a lucki winner number claim your prize text money number number over number million to give away ppt number x number normal text rate box number w number t number jy
0,i am realli sorri i will not b abl number do thi friday hope you can find an altern hope yr term is go ok
0,congratul ore mo owo re wa enjoy it and i wish you mani happi moment to and fro wherev you go
0,so do you have samu shoulder yet
0,what time you think you will have it need to know when i should be near campu
0,sinc when which side ani fever ani vomitin
0,k k are you in colleg
0,better made up for friday and stuf myself like a pig yesterday now i feel bleh but at least it not writh pain kind of bleh
0,no we sell it all so we will have ton if coin then sell our coin to someon thru paypal voila money back in life pocket
0,they are do it to lot of place onli hospit and medic place are safe
1,how about get in touch with folk wait for compani just txt back your name and age to opt in enjoy the commun number p sm
0,and also i have sorta blown him off a coupl time recent so id rather not text him out of the blue look for weed
0,i sent my score to sopha and i had to do secondari applic for a few school i think if you are think of appli do a research on cost also contact joke ogunrind her school is one me the le expens one
0,i cannot wait to see you how were the photo were use
1,you are cash balanc is current number pound to maxim you are cash in now send go to number onli number p messag cc number po box number number tcr w number
0,chk in you are belovd m dict
0,is that what time you want me to come
0,awesom let me know whenev you are around
0,beauti truth against graviti read care our heart feel light when someon is in it but it feel veri heavi when someon leav it good night
0,also rememb to get dobbi is bowl from your car
1,filthi stori and girl wait for your
0,love is not a decis it is a feel if we could decid who to love then life would be much simpler but then le magic
0,welp appar he retir
0,my sort code is and acc no is the bank is natwest can you repli to confirm i have sent thi to the right person
0,you sure you can not take ani sick time
0,yo chad which gymnast class do you want to take the site say christian class is full
0,or better still can you catch her and let ask her if she can sell lt gt for me
0,i am not sure about night menu i know onli about noon menu
0,what do you want when i come back a beauti necklac a a token of my heart for you that is what i will give but onli to my wife of my like be that and see no one can give you that do not call me i will wait till i come
0,are you will to go for aptitud class
0,it will not b until number number a tri number sort hous out is that ok
0,haha awesom omw back now then
0,what is your account number
0,ok i shall talk to him
0,do not hesit you know thi is the second time she ha had weak like that so keep i notebook of what she eat and did the day befor or if anyth chang the day befor so that we can be sure it noth
0,hey you can pay with salari de onli lt gt
0,anoth month i need chocol weed and alcohol
0,if he start search he will get job in few day he have great potenti and talent
0,reckon need to be in town by eightish to walk from carpark
0,look at the fuckin time what the fuck you think is up
0,yo guess what i just drop
0,carlo say he will be at mu in lt gt minut
0,i am in offic now i will call you lt gt min
0,geeee i miss you alreadi you know your all i can think about fuck i can not wait till next year when we will be togeth love kiss
0,ugh got to drive back to sd from la my butt is sore
0,the xma stori is peac the xma messag is love the xma miracl is jesu hav a bless month ahead amp wish you merri xma
0,i can not i do not have her number
0,yetund i am in class can you not run water on it to make it ok pl now
0,not a lot ha happen here feel veri quiet beth is at her aunt and charli is work lot just me and helen in at the mo how have you been
0,aight will do thank again for comin out
0,no but heard about tat
0,lt gt am i think should say on syllabu
0,umma did she say anyth
0,give me a sec to think think about it
1,panason bluetoothhdset free nokia free motorola free doublemin doubletxt on orang contract call mobileupd number on number or call number optout
0,i do not quit know what to do i still can not get hold of anyon i cud pick you up bout number number pm and we can see if they are in the pub
0,poyyarikatur kolathupalayam unjalur post erod di lt gt
0,dear hero i am leav to qatar tonit for an apt opportun pl do keep in touch at lt email gt kerala
0,lol i would but my mom would have a fit and tell the whole famili how crazi and terribl i am
0,i just got home babe are you still awak
0,just buy a pizza meat lover or suprem you get to pick
0,ya told she wa ask wat matter
0,dear regret i cudnt pick call drove down frm ctla now at cochin home left mobil in car ent style ishtamayoo happi bakrid
0,shall i send that exe to your mail id
0,don know wait i will check it
0,good afternoon on thi gloriou anniversari day my sweet j i hope thi find you happi and content my prey i think of you and send a tea kiss from across the sea coax imag of fond souveni you cougar pen
0,we still on for tonight
0,may i call you later pl
0,ha not that been the pattern recent crap weekend
0,i have a sore throat it is scratch when i talk
0,ye da ani plm at you are offic
0,are you not around or just still asleep v
0,lol you forgot it eh ye i will bring it in babe
0,it good we will find a way
0,can not use foreign stamp in thi countri good lectur
0,oh mr sheffield you want to play that game okay you are the bos and i am the nanni you give me a rais and i will give you one
0,hello babi did you get back to your mom is are you set up the comput now fill your belli how goe it loverboy i miss you alreadi sigh
0,no my blanket are suffici thank
0,naughti littl thought it better to flirt flirt n flirt rather than love someon n gettin hurt hurt n hurt gud nyt
0,they just talk that is it de they will not ani other
0,today am go to colleg so am not abl to atten the class
0,i am in class will holla later
0,come round it is
0,do number thing chang that sentenc into becaus i want number concentr in my educ career i am leav here
1,number is flirt now txt girl or bloke you are name age eg girl zoe number to number to join and get chat
0,are you avail for soire on june number rd
0,i got anoth job the one at the hospit do data analysi or someth start on monday not sure when my thesi will got finish
0,jay is get realli impati and belliger
0,tell me they are femal v how are you throw in we are decid what all to get now
0,i am work technic support voic process network field
0,i might come to kerala for number day so you can be prepar to take a leav onc i finalis do not plan ani travel dure my visit need to finish urgent work
0,ok not sure what time though a not sure if can get to librari befor class will tri see you at some point have good eve
1,we have new local date in your area lot of new peopl regist in your area repli date to start now number onli www flirtparti u repli number
0,that is fine i will bitch at you about it later then
0,onc free call me sir i am wait for you
0,meet you is my work tel me when shall i do my work tomorrow
0,alright i will make sure the car is back tonight
0,lul i am gettin some juici gossip at the hospit two nurs are talk about how fat they are gettin and one think she is obes oyea
0,aight ill get on fb in a coupl minut
0,oi ami parchi na re kicchu kaaj kort iccha korch na phone ta tul na plz plz
0,where can download clear movi dvd copi
0,yep by the pretti sculptur
0,me too watch surya movi onli after number pm vijay movi pokkiri
0,you tell what happen do not behav like thi to me ok no need to say
0,can you get pic msg to your phone
0,send to someon el
0,wat make some peopl dearer is not just de happi dat you feel when you meet them but de pain you feel when you miss dem
0,for me the love should start with attract i should feel that i need her everi time around me she should be the first thing which come in my thought i would start the day and end it with her she should be there everi time i dream love will be then when my everi breath ha her name my life should happen around her my life will be name to her i would cri for her will give all my happi and take all her sorrow i will be readi to fight with anyon for her i will be in love when i will be do the craziest thing for her love will be when i do not have to proov anyon that my girl is the most beauti ladi on the whole planet i will alway be sing prais for her love will be when i start up make chicken curri and end up maki sambar life will be the most beauti then will get everi morn and thank god for the day becaus she is with me i would like to say a lot will tell later
0,fr ndship is like a needl of a clock though v r in d same clock v r nt abl number met evn if v meet itz onli number few second bt v alwi stay conect gud number t
0,i do not think he ha spatula hand
0,you can never do noth
0,goodmorn today i am late for lt decim gt min
0,plea da call me ani mistak from my side sorri da pl da goto doctor
0,well the weather in cali is great but it complex are great you need a car to move freeli it tax are outrag but all in all it a great place the sad part is i miss home
0,now onli i reach home i am veri tire now i will come tomorro
0,ryder unsold now gibb
1,dear subscrib you are draw number number gift voucher will b enter on receipt of a correct an when wa elvi presley birthday txt answer to number
0,do not fret i will buy the ovul test strip and send them to you you will not get them til like march can you send me your postal address you will be alright okay
0,no gift you tri to get me to throw myself off a cliff or someth
0,you busi or can i come by at some point and figur out what we are do tomorrow
0,yeah go on then bore and depress sittin waitin for phone to ring hope the wind drop though scari
0,on hen night go with a swing
0,good afternoon my love how goe your day what are you up to i woke earli and am onlin wait for you hmmm italian boy is onlin i see grin
0,from someon not to smoke when everi time i have smoke in the last two week is becaus of you call or text me that you want to smoke
0,no you will just get a headach tri to figur it out you can trust me to do the math i promis o
0,s s first time dhoni rock
0,ok ill tell the compani
0,awesom think we can get an number th at usf some time tonight
0,so that mean you still think of teju
0,no i am good for the movi is it ok if i leav in an hourish
0,no no thi is kalli home ground amla home town is durban
0,so let u make it saturday or monday a per conveni
1,bore of speed date tri speedchat txt speedchat to number if you do not like them txt swap and get a new chatter chat number pobox number w number wq number p messag rcd number
0,cancel cheyyamo and get some money back
1,do you want number anytim ani network min number text and a new video phone for onli five pound per week call number now or repli for deliveri tomorrow
0,good morn princess how are you
1,for take part in our mobil survey yesterday you can now have number text number use howev you wish number get txt just send txt to number t c www txt number com number number p
0,not tonight mate catch up on some sleep thi is my new number by the way
0,height of oh shit situat a guy throw a love letter on a gal but fall on her brother head who is a gay d
0,so check your error and if you had difficulti do correct
0,howz pain hope you r fine
0,k do i need a login or anyth
1,do not forget you can place a mani free request with number stchoic co uk a you wish for more inform call number
0,lol no just wa busi
0,what you wear
0,oh a usual vijay film or it differ
0,and is there a way you can send shade is stuff to her and she ha been wonder too
1,thank you winner notifi by sm good luck no futur market repli stop to number custom servic number
0,babe i lost you
0,not a drop in the tank
0,that said can you text him one more time
1,number is of girl mani local number you who r virgin number thi r readi number number fil you are everi sexual need can you number fil their text cute to number number number p m
0,did you find a sitter for kaitlyn i wa sick and slept all day yesterday
0,sorri man accident left my phone on silent last night and did not check it til i got up
0,he is an adult and would learn from the experi there is no real danger i just do not like peep use drug they do not need but no comment
0,hey there is veggi pizza
0,you sure your neighbor did not pick it up
0,well i am computerless time to make some oreo truffl
0,haha yeah i see that now be there in a sec
0,i am not have her number sir
0,lol now i am after that hot air balloon
0,ok now i am in bu if i come soon i will come otherwis tomorrow
0,msg r not time pas they silent say that i am think of you right now and also make you think of me at least number a moment gd nt swt drm shesil
0,yeah we can probabl swing by onc my roommat finish up with hi girl
0,happi new year melodi
0,yay you better not have told that to number other girl either
0,did he say how fantast i am by ani chanc or anyth need a bigger life lift a lose the will number live do you think i would be the first person number die from n v q
0,just nw i came to hme da
0,i am outsid island head toward hard rock and you will run into me
0,to day class is there are no class
0,i am in chennai velacheri
0,you flippin your shit yet
0,k give me a sec break a lt gt at cstore
0,am i that much bad to avoid like thi
0,yo you around just got my car back
0,annoy is not it
0,goodmorn today i am late for lt gt min
0,there is no point hangin on to mr not right if he is not makin you happi
0,all will come aliv better correct ani good look figur there itself
0,in that case i guess i will see you at campu lodg
0,come to my home for one last time i will not do anyth trust me
0,i wa up all night too worri about thi appt it is a shame we miss a girl night out with quizz popcorn and you do my hair
1,sex up you are mobil with a free sexi pic of jordan just text babe to number then everi wk get a sexi celeb pocketbab co uk number more pic number number wk number
0,what he said is not the matter my mind say some other matter is there
0,neft transact with refer number lt gt for r lt decim gt ha been credit to the beneficiari account on lt gt at lt time gt lt gt
0,me also da i feel yesterday night wait til number day night dear
0,thank for understand i have been tri to tell sura that
0,the whole car appreci the last two dad and are have a map read semi argument but apart from that thing are go ok p
0,i need you to be in my strong arm
0,also maaaan are you miss out
0,hi birthday real is in april
0,guessin you ai not go to be here befor number
0,ok then i will come to you are home after half an hour
0,yo the game almost over want to go to walmart soon
0,i will text now all creepi like so he will not think that we forgot
0,that would be good i will phone you tomo lunchtim shall i to organis someth
0,damn can you make it tonight or do you want to just wait til tomorrow
0,k k i am also fine when will you complet the cours
0,true it is passabl and if you get a high score and appli for phd you get number year of salari so it make life easier
0,prakesh is there know
0,teach me app da when you come to colleg
0,rofl betta invest in some anti age product
0,sir you will receiv the account no anoth number hr time sorri for the delay
1,repli with your name and address and you will receiv by post a week complet free accommod at variou global locat www phb number com ph number p
1,free entri into our number weekli comp just send the word enter to number now number t c www textcomp com cust care number
0,i want to send someth that can sell fast lt gt k is not easi money
0,have got few thing to do may be in pub later
0,number is finish meet call me
0,lol ok i will snatch her purs too
0,how much are we get
0,dear reliev of westonzoyland all go to plan thi end too
0,hope you are have a great new semest do wish you the veri best you are made for great
0,oh ye i can speak txt number you no hmm did you get email
0,i want to show you the world princess how about europ
0,nobodi can decid where to eat and dad want chine
0,no shoot me i am in the doc wait room
0,hello which the site to download song it urgent pl
0,i do know what you mean is the king of not havin credit i am goin number bed now night night sweet onli number more sleep
0,yeah like if it goe like it did with my friend i am go to flip my shit in like half an hour
0,what your plan for pongal
0,just wait till end of march when el nino get himself oh
0,not yet chikku go to room nw i am in bu
0,am also do in cbe onli but have to pay
0,honey boo i am miss you
0,yo i am at my parent gettin cash good news we pick up a downstem
